Diagram-ID,Tester-ID,Unique-ID,Image-Path,Modified-Alt-Text
11,2,PHYS-11-2,ai/data/image11.png,"The diagram illustrates a magnetic circuit comprising a loop with defined parameters, including a conductive coil and associated currents. The central element is a circular loop with winding numbers 𝑁1 and 𝑁2 labeled on opposite sides, indicating the coil turns connected to voltage sources 𝑉1 and 𝑉2. The radius of the loop is marked as 𝑟𝑜 = 10 cm. An arrow within the loop indicates the direction of current 𝑖1(𝑡), suggesting the variable nature of the current over time. As this current changes with time, it produces a changing magnetic field around the coil, which in turn affects the magnetic flux through the loop. The diagram helps to analyze electromagnetic behavior, facilitating calculations of magnetic fields, inductance, and related phenomena in circuits. Key elements like the coil's orientation and current direction reveal potential trends in magnetic flux and illustrate the relationships governing electromagnetic theory."
12,2,PHYS-12-2,ai/data/image12.png,"The illustration displays two related diagrams that depict physical systems used to analyze magnetic fields. The left diagram shows a circular loop labeled 𝑆₁ with path length 𝐿, enclosing an input current 𝐼 that circulates around the loop in the indicated direction. The right diagram shows a concave loop labeled 𝑆₂, also with path length 𝐿 and enclosed current 𝐼, with the current following the shape of the loop. Both diagrams represent different closed paths that can be chosen when applying Ampère’s Law, which relates the magnetic field strength along a path to the total current enclosed by that path. The circular loop suggests a more uniform magnetic field along its length, while the concave loop illustrates how changing the path geometry can lead to variations in field strength. Together, the two shapes demonstrate that Ampère’s Law depends on the chosen path and enclosed current, not the specific shape itself."
13,2,PHYS-13-2,ai/data/image13.png,"On the left side, an electric circuit is shown with a voltage source V driving a current I through a resistor R. In this analogy, the voltage V represents the magnetomotive force (MMF), which is the “driving force” that pushes magnetic effects through a magnetic circuit, similar to how voltage pushes electric current. The resistor R corresponds to magnetic reluctance, which describes how strongly a material resists the formation of magnetic flux, much like electrical resistance opposes current flow. On the right side, a magnetic circuit is shown as a toroid wrapped with N current-carrying turns. The current flowing through the coil produces magnetic flux Φ (phi) inside the toroid, which is the magnetic equivalent of electric current. Increasing the number of turns N increases the magnetomotive force, thereby strengthening the magnetic flux, just as increasing voltage increases current in an electric circuit. The toroid acts as a closed magnetic path that confines and guides the magnetic field, reducing magnetic leakage and ensuring the flux circulates efficiently within the core material. Together, the diagram illustrates the full analogy between electric and magnetic circuits, showing how electrical concepts map directly onto magnetic behavior."
14,2,PHYS-14-2,ai/data/image14.png,"The diagram displays a representation of a helical structure, characterized by a series of spiraling lines that denote magnetic field lines, illustrated in black, along a central axis depicted in green. The helical lines are numbered sequentially from 1 to N, suggesting multiple loops or windings around the axis. Magnetic field lines pass through the surface enclosed by each loop, and each loop adds to the total magnetic effect. Key equations are presented in green text, where 𝜓 = B · S shows that the magnetic flux through one loop depends on how strong the magnetic field is and the area of the loop, while 𝜆 = N𝜓 indicates that the total flux linkage increases as more loops are added. Together, these relationships show that the total magnetic linkage builds up from the contributions of all loops and depends on both the field strength and the number of loops."
15,2,PHYS-15-2,ai/data/image15.png,"A toroid has current-carrying conductors at both the inner and outer radii. The current, marked in red, flows into the page at the outer radius and out of the page at the inner radius. These opposing current directions cause the magnetic field to form a closed loop inside the toroid, rather than spreading outward. The magnetic field B, marked in green, flows inside the toroid in an anti-clockwise direction. The direction of the field follows the right-hand rule, where curling the fingers in the direction of the current gives the direction of the magnetic field. Because the field is confined to a circular path inside the toroid, Ampère’s Law can be applied by choosing a circular loop inside the core, where the enclosed current determines the field strength and direction."
16,2,PHYS-16-2,ai/data/image16.png,"This diagram shows a conducting medium arranged in three-dimensional space. The horizontal axis w represents the width of the conductor, the vertical axis h represents its height, and the z-axis points upward, indicating depth. First, the red boxes mark regions where electric current flows. Arrows on these boxes show the direction of current through the material in three dimensions. This means electric charges move through the conductor along the indicated paths, not just in a flat plane but through space. Second, the green circles and crosses represent moving charge carriers, such as electrons, showing whether they move toward or away from the viewer along the z-direction. This helps indicate how charges circulate within the conductor. Third, a magnetic field B is present around the current-carrying regions. As the charges move, they generate magnetic flux around the conductors. When moving charges interact with the magnetic field, a magnetic force can act on them, depending on the direction of motion and the field orientation. Together, the diagram illustrates how current flow in three dimensions produces magnetic flux and can lead to magnetic forces, linking charge motion, current direction, and magnetic field behavior in the system."
17,2,PHYS-17-2,ai/data/image17.png,"The diagram illustrates a helical coil, showing its structure in a three-dimensional perspective. Key elements include the dimensions labeled as 𝑑 for diameter and 𝑧 indicating the axial direction, showing how the coil extends in space. There are also markings for 𝑁 representing the number of turns, and 𝑝 defined as the pitch, which is the distance between successive turns. A smaller pitch means the turns are closer together, which increases inductance by strengthening the magnetic field. The light blue color of the coil emphasizes its three-dimensionality and spiraling form."
18,2,PHYS-18-2,ai/data/image18.png,"The illustration presents two distinct scenarios related to electromagnetic fields and their behavior concerning closed surfaces. On the left, the diagram represents the electric field around a positive charge (+Q), signifying that the net electric flux through the closed surface is equal to the total charge enclosed, as indicated by the expression Ψ = Q. Field lines leaving the surface correspond to positive charge, while field lines entering a surface would indicate negative charge. The field lines emanate outward from the charge, clearly showing the directional flow and density of the electric field. On the right, the illustration depicts a magnetic field around a closed surface with no enclosed magnetic charge (N and S denote a magnetic dipole), where the net magnetic flux is represented as Ψ = 0, indicating that magnetic field lines do not start or end within the surface. Magnetic field lines always form closed loops, entering and exiting the surface in equal amounts. Both diagrams utilize arrows to communicate the direction of field lines, emphasizing the divergence of electric fields and the absence of magnetic monopoles."
19,2,PHYS-19-2,ai/data/image19.png,"The horizontal ground on which the weightlifter stands is labeled “y = 0.” The motion of the barbell lift at three positions is shown. In the final position, the barbell is directly above the lifter’s head with arms fully extended vertically. At this final position, the barbell is momentarily at rest, meaning it is not moving. In this position, two arrows point from the center of the barbell: the vector F₍weightlifter₎ points vertically upward along the vertical axis, and the vector w = F₍gravity₎ points vertically downward along the same axis. Because the barbell is not accelerating at this point, Newton’s First Law applies and the forces are balanced. The vertical distance between the ground and the bottom of the barbell is h, and the work done by the lifter in raising the barbell is stored as gravitational potential energy at this final height."
20,2,PHYS-20-2,ai/data/image20.png,"Two opposite poles of two different magnets are placed near each other. The magnetic flux density B, marked in green, comes out of the north pole and enters the south pole. A conductor is placed between the opposite magnetic poles and carries a current I, marked in red. The magnetic force Fₘ acts downward, perpendicular to the magnetic flux density. The direction of this force follows the right-hand rule: the thumb points in the direction of the current, the fingers point in the direction of the magnetic field, and the palm shows the direction of the magnetic force."
21,2,PHYS-21-2,ai/data/image21.png,"Two circular current-carrying loops, labeled 1 and 2, are placed close to each other and may be parallel or angled relative to one another. Each loop carries a current, with the direction of current flow shown along the circular paths. The current in loop 1 generates a magnetic field that spreads through space and passes through loop 2, linking the two loops magnetically. This interaction is the basis of mutual inductance, where a changing current in one loop can induce an effect in the other. A vector R₂₁ connects a small current element on loop 1 to a point on loop 2, pointing from the source of the magnetic field to where its influence is felt. Together, the loops and vector illustrate how magnetic fields produced by one circuit affect another nearby circuit, forming the physical foundation for inductive coupling."
22,2,PHYS-22-2,ai/data/image22.png,"On the left side, a rectangular loop carrying a current I is placed in a magnetic flux density B, marked in blue. The length and width of the loop are labeled L and W, respectively. Magnetic forces act on the current-carrying sides of the loop, and opposite sides experience forces in opposite directions. On the right side, the rectangular loop is tilted so that its width makes an angle with the magnetic flux density B. The forces act perpendicular to B on each side of the loop, but because these forces point in different directions on opposite sides, they create a twisting effect, or torque. This torque tends to rotate the loop so that it aligns with the magnetic field, explaining how magnetic forces produce rotational motion in a current-carrying loop."
23,2,PHYS-23-2,ai/data/image23.png,"The image represents a three-dimensional coordinate system illustrating spherical coordinates, characterized by the radius 𝑟, polar angle 𝜃, and azimuthal angle 𝜙. This coordinate system is commonly used to describe the magnetic field produced by a magnetic dipole, such as a bar magnet or a tiny current loop. In this context, the coordinates help specify the direction and strength of the magnetic field at different points around the dipole. The axes are labeled with the x-axis extending horizontally, the y-axis perpendicular to it, and the z-axis extending vertically, which is typically aligned with the dipole’s magnetic moment. The distance 𝑟 measures how far a point is from the center of the dipole, 𝜃 is the vertical angle measured down from the z-axis, and 𝜙 is the horizontal angle measured around the z-axis. A circular shape, marked in blue, signifies the plane in which the angles are defined, while dashed lines show how a point projects onto the coordinate axes. This system emphasizes the relationship between the spherical coordinates and their Cartesian counterparts."
24,2,PHYS-24-2,ai/data/image24.png,"""The nine panels together show the contraction and expansion of a piece of spring that is stretched and then released. The length of the spring is oriented horizontally. The left end of the spring is secured to a vertical surface. The right end is attached to a cube block.
The panels are stacked one over the other, from a to i in the downward direction, with all instances of the left end of the spring vertically aligned. Three vertical, equidistant dashed lines are drawn through the nine panels. The line in the middle is labeled “x equals 0.” The line to the left is labeled “x equals negative A,” and the line to the right is labeled “x equals plus A.”
In each panel, two forces are represented by arrows of two different lengths pointing horizontally from the center of the object. The long arrow has a length that equals the horizontal distance between one vertical dashed line and the next. The short arrow is a little more than half that length. The nine panels are as follows:
 In panel a, the center of the object is at x equals plus A. A long leftward arrow labeled “vector F” points to x equals 0. Here, “vector v equals 0.” Callout 1 reads, “Stretch the spring and release the block from rest at x equals plus A.”
In panel b, the right side of the object is at x equals plus A. Two short leftward arrow point to x equals 0: one labeled “vector F” and the other labeled “vector v.” Callout 2 reads, “The restoring force of the spring makes the block speed up.”
In panel c, the center of the object is at x equals 0. A long leftward arrow labeled “vector v” points to x equals negative A. Here vector, “F equals 0.” Callout 3 reads, “The block is at maximum speed as it passes through the equilibrium position at x equals 0.”
In panel d, the left side of the object is at x equals negative A. Two short arrows are shown: a rightward arrow labeled “vector F” and a leftward arrow labeled “vector v.” Callout 4 reads, “The block overshoots x equals 0; the restoring force then makes it slow down.”
In panel e, the center of the object is at x equals negative A. A long rightward arrow labeled “vector F” points to A equals 0. Here, “vector v equals 0.” Callout 5 reads, “The block comes to rest momentarily at x equals negative A.”
In panel f, the left side of the object is at x equals negative A. Two short rightward arrows point to A equals 0: one labeled “vector F” and the other labeled “vector v.” Callout 6 reads, “The restoring force again accelerates the block toward the equilibrium position.”
 In panel g, the center of the object is at x equals 0. A long rightward arrow labeled “vector v” points to x equals plus A. Here, “vector F equals 0.” Callout 7 reads, “The block again passes through the equilibrium position at x equals zero at maximum speed.”
 In panel h, the right side of the object is at x equals plus A. Two short arrows are shown: a rightward arrow labeled “vector v” and a leftward arrow labeled “vector F.” Callout 8 reads, “The block overshoots x equals 0 again; the restoring force again makes it slow down.”
 In panel i, the center of the object is at x equals plus A. A long leftward arrow labeled “vector F” points to x equals 0. Here, “vector v equals 0.” Callout 9 reads, “The block is again at rest at x equals plus A; the cycle now starts over.”"""
25,2,PHYS-25-2,ai/data/image25.png,"A magnet bar is placed in a magnetic field density B, marked in blue. The magnetic field applies forces at the north and south poles of the bar in opposite directions. These equal and opposite forces do not cancel but instead create a twisting effect, or torque, on the magnet. This torque causes the bar to rotate until it aligns with the direction of the applied magnetic field, explaining how magnetic dipoles orient themselves in an external field."
26,2,PHYS-26-2,ai/data/image26.png,"The diagram shows the shapes of atomic orbitals as the orbital type changes from s to g. The 1s orbital is spherical, meaning the electron is equally likely to be found in all directions around the nucleus, showing complete symmetry. The 2p orbitals have a two-lobed, dumbbell shape, indicating that the electron is most likely found in two opposite regions, with the orientation changing depending on direction but keeping the same basic symmetry. The 3d orbitals are more complex, with shapes that include four lobes arranged around the nucleus or a flat disc with lobes above and below, showing that electrons occupy specific angular regions rather than all directions equally. The 4f orbitals have many lobes arranged in layered and circular patterns, indicating increased angular complexity and less overall symmetry. The 5g orbitals are the most complex, with multiple discs and many narrow lobes spread in layers, showing that the electron probability is divided among many distinct regions around the nucleus. Overall, the progression from s to g orbitals shows how electron distributions become more structured and directional as angular momentum increases, with each shape representing where an electron is most likely to be found rather than a fixed path."
27,2,PHYS-27-2,ai/data/image27.png,"On the left side, magnetic dipoles in a small volume are shown with scattered directions when no external magnetic field is applied, meaning B = 0. In this case, thermal motion causes the dipoles to remain randomly oriented. On the right side, when an external magnetic field B is applied, the magnetic dipoles are oriented in the same direction as the field. Each dipole experiences a torque due to the magnetic field, which causes it to rotate and gradually align with the field over time."
28,2,PHYS-28-2,ai/data/image28.png,"The image features two diagrams illustrating the concept of the cross product of two vectors, A and B. On the left, a hand gesture symbolizes the right-hand rule for determining the direction of the resultant vector, A × B, with the thumb pointing in the direction of the resultant and the fingers curling from vector A to vector B. The angle θ is marked, showing the orientation between the two vectors. On the right, a conical surface represents the magnitude of the cross product as the area of the parallelogram formed by A and B. The size of this area depends on the angle between the vectors: it increases as the angle opens and reaches its maximum when the vectors are perpendicular at 90 degrees. This ties the angle between the vectors directly to the magnitude of the cross product, alongside the use of the right-hand rule to determine direction."
29,2,PHYS-29-2,ai/data/image29.png,"An S-shaped microstrip patch antenna is shown radiating electromagnetic waves. The shape of the patch controls how currents flow along the antenna, causing charges to oscillate back and forth along the S-shaped path. This oscillating current produces a time-varying electric field, which in turn generates a time-varying magnetic field. The electric field is perpendicular to the magnetic field, and both fields change together as the wave propagates. The direction of wave propagation is perpendicular to both fields, forming a transverse electromagnetic wave. The S-shape alters the current path length and distribution, which affects the radiation pattern, resonance, and directionality of the emitted waves. This illustrates how antenna geometry directly influences electromagnetic radiation behavior."
30,2,PHYS-30-2,ai/data/image30.png,"This contour plot illustrates a three-dimensional surface represented in a two-dimensional format, showing the relationship between two variables, 𝑥₁ and 𝑥₂. The axes are labeled 𝑥₁ (horizontal) and 𝑥₂ (vertical), each ranging from approximately −3 to 3. The plot features several contour lines in blue, green, and red, with numeric labels such as 100, 250, and 500 indicating constant function values. The contours form a convex pattern resembling a parabolic surface, suggesting a local minimum at the origin where the function value is lowest. Gradient vectors at any point would point perpendicular to the contour lines and toward this minimum, indicating the direction of steepest descent. This shows that as 𝑥₁ and 𝑥₂ approach zero, the function value decreases, a key idea in optimization that helps explain convergence toward stable solutions."
31,2,PHYS-31-2,ai/data/image31.png,"The 3D contour plot illustrates a scalar field represented by the variable V, shown across the x, y, and z axes. Contour lines mark locations where V has the same value, labeled as V₁, V₂, and V₃. The gradient vector ∇V points from lower values of V toward higher values, showing the direction of the steepest increase of the variable in space. Points P, P₁, and P₂ illustrate how moving in the direction of ∇V increases V most rapidly compared to other directions. Gradient vectors are perpendicular to the contour lines, which helps determine their direction visually. Where contour lines are closer together, the gradient is steeper, meaning V changes more rapidly over distance; where they are farther apart, the change is more gradual. This way of reading the plot is especially important for electric potential in space, where ∇V indicates the direction of the strongest change in potential and helps determine the associated electric field behavior."
32,2,PHYS-32-2,ai/data/image32.png,"The image illustrates three distinct vector field representations centered around point P, showcasing different directional behaviors. The leftmost configuration reveals a radiating pattern, where arrows emanate outward from P, indicating a source-like behavior, similar to the electric field around a positive charge where field lines flow outward. The middle arrangement presents an inward-directed flow, with arrows converging toward P, representing a sink-like behavior, analogous to a negative charge where field lines flow inward. The rightmost depiction shows parallel arrows that suggest a uniform flow, indicating constant vector magnitude and direction without variation in intensity."
33,2,PHYS-33-2,ai/data/image33.png,"The graph illustrates trends in functional CPU scaling over time, spanning from 2008 to 2030, with a logarithmic vertical axis labeled “Log (Functional CPU Scaling)” and a horizontal axis denoting “Year of 1st Production.” The curves show different strategies used to improve CPU performance as traditional transistor scaling slows. Design Technology Co-Optimization (DTCO) refers to improving performance by optimizing circuit design, layout, and architecture within a given technology node, while System Technology Co-Optimization (STCO) goes further by co-developing the chip together with packaging, memory, and system-level technologies. Key milestones such as 14 nm and 7 nm mark points where shrinking transistor sizes alone provided diminishing returns due to physical and economic limits. The green line highlights a shift away from relying only on smaller transistors toward design-based and system-level solutions, showing how DTCO helps recover performance gains even when scaling slows. This trend explains why performance continues to improve despite the limits of traditional Moore’s-law scaling: innovation increasingly comes from smarter design choices and system integration rather than transistor size reduction alone."
34,2,PHYS-34-2,ai/data/image34.png,"The chart shows how semiconductor manufacturing has evolved from 1970 to 2020 by tracking node size, wafer size, and de-magnification ratios. Over time, node sizes steadily decrease, meaning transistors become smaller, faster, and more energy-efficient, which improves chip performance while reducing power consumption. At the same time, wafer sizes increase, allowing manufacturers to produce more chips on a single wafer, which boosts production capacity and lowers cost per chip. The chart also shows increasing de-magnification ratios showing a transition from 1:1 to 4:1, which indicate how lithography systems shrink circuit patterns when printing them onto larger wafers, enabling very small features to be manufactured accurately. These trends explain how the industry continues to improve performance and efficiency by combining smaller transistors, larger wafers, and advanced patterning techniques."
