Diagram-ID,Tester-ID,Unique-ID,Image-Path,Modified-Alt-Text
14,Fr,PHYS-14-Fr,ai/data/dielectricSphere.png,"A dielectric sphere placed in a uniform external electric field. A light-blue circular region represents the dielectric material, while red field lines depict the electric field passing through and around it. Far from the sphere, the field lines are straight and evenly spaced, indicating a uniform field. As the field enters the dielectric, the lines bend and become distorted, showing how the material polarizes in response to the applied field. This distortion reflects the alignment of bound charges within the dielectric, which partially oppose the external field and reduce its
strength inside the sphere. The diagram illustrates a key concept in electromagnetism: dielectric materials do not block electric fields like conductors, but instead modify the field through polarization, altering the field distribution both inside and around the object."
15,Fr,PHYS-15-Fr,ai/data/LTISystem.png,"Block diagram illustrating the frequency-domain representation of a linear time-invariant (LTI) system. The input signal 𝑥 passes through a system with impulse response ℎ to produce the output 
𝑦. Blue arrows indicate transformation to the frequency domain using the continuous-time Fourier transform (CTFT), where the system is represented by its transfer function 𝐻(𝜔). The output spectrum is obtained by multiplying the input spectrum by 𝐻(𝜔), and the inverse CTFT (CTFT−1) returns the result to the time domain. This diagram emphasizes the key idea that convolution in time corresponds to multiplication in frequency, greatly simplifying the analysis and design of signals and systems."
16,Fr,PHYS-16-Fr,ai/data/vectorAddition.png,"Vector addition diagram illustrating the parallelogram method. Two vectors, 𝐴⃗ and 𝐵, are drawn from a common starting point, with 𝐴 angled upward and 𝐵 extending horizontally. Copies of these vectors complete a parallelogram, showing how their directions and magnitudes combine geometrically. The red diagonal arrow labeled 𝐴⃗ + 𝐵 represents the resultant vector obtained by adding 𝐴 and 𝐵. An angle 𝜃 between one vector and the horizontal reference axis is marked, emphasizing how vector direction affects the resultant. This diagram conveys the core idea that vectors add according to both magnitude and direction,
a fundamental concept used in physics to combine forces, velocities, displacements, and other vector quantities."
17,Fr,PHYS-17-Fr,ai/data/logicDiagram.png,"A digital logic diagram demonstrating how unsigned binary addition scales from small to larger bit widths using full adders as modular building blocks. At the top, a three-bit unsigned number is shown, where input bits 𝑧2, 𝑧1, and 𝑧0 are applied to a full adder with inputs 𝑥, 𝑦, and carry-in 𝑐_𝑖𝑛. The full adder produces a sum bit 𝑠 and a carry-out 𝑐_𝑜𝑢𝑡, and together these signals represent the binary addition result for that stage.
The lower portion generalizes this idea to a six-bit unsigned number (𝑧0,𝑧1,𝑧2,𝑧3,𝑧4,𝑧5). The bits are divided into groups and processed by multiple full adders operating in parallel and in sequence. Intermediate sum outputs 𝑠1 and 𝑠2, along with carry signals 𝑐_𝑜𝑢𝑡1 and 𝑐_𝑜𝑢𝑡2, are passed into a larger 2-bit adder built from two additional full adders. Carry signals propagate through the network, ultimately producing final result bits 𝑅1 and 𝑅2 and a final carry-out that indicates overflow.
This diagram emphasizes a foundational principle of digital system design: complex arithmetic operations are constructed by systematically connecting simple, well-defined components. By chaining full adders and managing carry propagation, designers can implement reliable multi-bit addition, a core operation underlying processors, arithmetic logic units (ALUs), and digital computation more broadly."
18,Fr,PHYS-18-Fr,ai/data/voltageCurrent.png,"Graph titled “Voltage vs Current of Four Different Circuits” showing the relationship between voltage (vertical axis, in volts) and current (horizontal axis, in milliamps) for four separate electrical circuits. Each circuit’s data points form a straight line, indicating a linear voltage–current relationship consistent with Ohm’s law. Dotted trendlines are drawn through each set of points, with equations labeled above them; the slope of each line represents the effective resistance of that circuit. Circuit 2 has the steepest slope, meaning it has the highest resistance (a small increase in current requires a 
large increase in voltage), while Circuit 4 has the shallowest slope, indicating the lowest resistance. Circuits 1 and 3 fall between these extremes. The small intercept values near zero show minimal offset or measurement error. Overall, the graph illustrates how different circuit resistances affect the voltage required to drive a given current, reinforcing the idea that resistance determines the proportionality between voltage and current in linear, resistive systems."
19,Fr,PHYS-19-Fr,ai/data/voltageCurrent2.png,"Graph titled “Voltage vs Current of Four Different Circuits” plotting current (vertical axis, in milliamps) as a function of voltage (horizontal axis, in volts) for four different electrical circuits. Each circuit’s measured data points lie along a straight line, and dotted linear trendlines with equations are shown, indicating a proportional relationship between voltage and current consistent with Ohm’s law. The slope of each line represents the circuit’s electrical conductance (the inverse of resistance): steeper slopes correspond to lower resistance, while shallower slopes indicate higher resistance. 
Circuit 4 shows the steepest slope and therefore the lowest resistance, whereas Circuit 2 has the smallest slope, indicating the highest resistance. Circuits 1 and 3 fall in between. The near-zero intercepts suggest minimal offset or experimental error. Overall, the graph reinforces how different circuit resistances affect how much current flows for a given applied voltage and demonstrates the linear behavior of resistive components."
20,Fr,PHYS-20-Fr,ai/data/ionizationAtomic.png,"Graph showing first ionization energy versus atomic number for the elements, with ionization energy (in electron volts) on the vertical axis and atomic number on the horizontal axis. The data form a repeating, jagged pattern rather than a smooth curve. Sharp peaks occur at the noble gases—labeled Helium, Neon, Argon, Krypton, Xenon, and Radon—indicating very high ionization energies due to their stable, filled electron shells. Immediately after each peak, the ionization energy drops sharply at the alkali metals (not labeled), reflecting how easily a single outer electron can be removed when a new shell begins. 
Within each period, ionization energy generally increases as atomic number increases, due to increasing nuclear charge pulling electrons more tightly toward the nucleus, with small dips caused by electron shielding and subshell effects. Overall, the graph visually demonstrates the periodic nature of atomic structure, showing how electron configuration and shell filling govern the energy required to remove an electron from an atom."
21,Fr,PHYS-21-Fr,ai/data/sequentialLogic.png,"A sequential logic circuit showing a feedback-based storage element. An input signal 𝐷 enters an XOR gate, whose other input is fed back from the output 𝑄 of a T flip-flop. The output of the XOR gate drives the 𝑇 input of the flip-flop, while a clock signal controls when the flip-flop updates its state. The flip-flop provides complementary outputs 𝑄 and 𝑄‾​, with 𝑄 fed back to the XOR gate. This diagram illustrates how feedback and clocked storage combine to create state-dependent behavior: on each clock edge, the flip-flop toggles or holds its value depending on the relationship between the input 𝐷 and the current state 𝑄. 
Such configurations are fundamental in digital systems for implementing registers, counters, and state machines, where past outputs influence future behavior."
22,Fr,PHYS-22-Fr,ai/data/surfaceTension.png,"Surface tension forces on a floating object. A black spherical object rests in a shallow depression on a blue water surface. The downward arrow labeled 𝐹𝑤 represents the object’s weight due to gravity. On either side of the object, angled upward arrows labeled 𝐹𝑠 represent surface tension forces exerted by the stretched water surface at the contact line. These forces act tangentially along the water surface and have upward components that help support the object against gravity. The curved shape of the water surface shows how surface tension causes the liquid to deform, creating a restoring force. 
This diagram demonstrates how surface tension can partially or fully balance an object’s weight, allowing small objects to float even if they are denser than water."
23,Fr,PHYS-23-Fr,ai/data/blockDiagram.png,"A block on an inclined plane illustrating force decomposition and friction. A rectangular block rests on a plane inclined at an angle 𝜃 to the horizontal. The downward arrow labeled weight represents the gravitational force acting on the block. This weight is resolved into two components: 𝑤sin⁡𝜃, acting parallel to the incline and tending to pull the block down the slope, and 𝑤cos⁡𝜃, acting perpendicular to the surface and pressing the block into the plane. An arrow labeled friction points up the slope, opposing the direction of potential motion. The angle 𝜃 is marked at the base of the incline. This diagram 
demonstrates how analyzing forces along and perpendicular to an inclined surface simplifies the application of Newton’s laws, showing how friction and gravity determine whether the block remains at rest, slides at constant speed, or accelerates down the plane."
24,Fr,PHYS-24-Fr,ai/data/blockDiagram2.png,"Detailed free-body diagram of a block on an inclined plane showing all force vectors acting at the block’s center of mass. The plane is inclined at an angle 𝛼, with base 𝑏 and height ℎ. The downward vertical arrow 𝐹𝐺 represents the gravitational force (weight). This force is resolved into two components: 𝐹_𝐺,𝑁, acting perpendicular to the surface and pressing the block into the incline, and 𝐹_𝐺,𝐻, acting parallel to the surface and tending to pull the block down the slope. An upward arrow perpendicular to the plane labeled 𝐹𝑁 represents the normal force exerted by the surface on the block. A blue arrow 𝐹𝑅 acts along the plane, 
representing friction or a resistive force opposing motion. The diagram illustrates how gravity is decomposed relative to the inclined surface and how the normal and frictional forces interact to determine the block’s equilibrium or motion, providing a clear visual framework for applying Newton’s laws on inclined planes."
25,Fr,PHYS-25-Fr,ai/data/blockDiagram3.png,"A block on an inclined plane showing the primary forces acting on it. A rectangular block rests on a sloped surface. The downward blue arrow labeled 𝑊 represents the block’s weight acting vertically due to gravity. A green arrow labeled 𝑁 points upward and perpendicular to the inclined surface, representing the normal force exerted by the plane on the block. A brown arrow labeled 𝐹 acts along the surface of the incline, representing the frictional force opposing the block’s tendency to slide down the slope. This diagram illustrates how forces on an incline are not aligned with the horizontal and vertical axes, and highlights 
the role of the normal force and friction in balancing gravity. It provides a clear visual basis for analyzing equilibrium and motion on inclined planes using Newton’s laws."
26,Fr,PHYS-26-Fr,ai/data/blockDiagram4.png,"A solid sphere of mass 𝑀 and radius 𝑅 on an inclined plane at an angle 𝜃, illustrating the forces and geometry involved in rolling motion. A horizontal red arrow labeled 𝐹⃗ represents an applied force acting through the sphere’s center. Inside the sphere, a dashed line marks the line of action of the force, and a radial arrow labeled 𝑅 indicates the distance from the center to the surface. The sphere rests on the sloped surface, which sets the direction of motion and contact forces. This diagram is used to analyze translation and rotation together: the applied force can cause both linear acceleration of the center of mass and 
angular acceleration about the center, depending on friction at the contact point. It highlights how rolling dynamics depend on mass distribution (moment of inertia), applied forces, and the incline angle, a key concept in rotational mechanics."
27,Fr,PHYS-27-Fr,ai/data/eulersDisk.png,"The mechanics of Euler’s disk, highlighting the directions of rotation and precession using axial vectors. An orange, tilted disk represents the spinning object in contact with a horizontal surface. An arrow labeled 𝜔 points along the disk’s symmetry axis, indicating the disk’s angular velocity (spin) about its own axis. A vertical arrow labeled 𝛺 represents the precession angular velocity, pointing upward along the vertical axis about which the disk’s orientation slowly rotates. A dashed elliptical curve on the surface shows the path traced by the disk’s point of contact as it precesses. This diagram emphasizes that Euler’s 
disk exhibits two coupled motions simultaneously—rapid spin about its symmetry axis and slower precession of that axis around the vertical—an interplay governed by angular momentum, torque from gravity and contact forces, and energy dissipation due to friction."
28,Fr,PHYS-28-Fr,ai/data/massSpring.png,"A mass–spring system on a horizontal surface used to study one-dimensional motion and oscillations. A small block of mass 𝑚 rests on top of a larger base of mass 𝑀. The block is attached on its left side to a spring fixed to a rigid vertical wall. A horizontal arrow labeled ℓ indicates the displacement of the block along the surface, showing the direction in which the block can move. A downward arrow labeled 𝑚 marks the weight of the block acting due to gravity, while the base mass 𝑀 is shown resting on the ground. The spring exerts a restoring force on the block when it is stretched or compressed, causing the block to accelerate back 
toward equilibrium. This diagram illustrates fundamental concepts in classical mechanics, including Hooke’s law, Newton’s second law, and how spring–mass systems model vibrations, oscillatory motion, and energy exchange between kinetic and potential energy."
29,Fr,PHYS-29-Fr,ai/data/massSpring2.png,"A mass–spring–damper system fixed to a rigid wall. A mass 𝑚 is connected to the wall through a spring with stiffness 𝑘 and a dashpot (damper) with damping coefficient 𝑐, arranged in parallel. An external time-varying force 𝐹(𝑡) acts on the mass in the horizontal direction, producing a displacement response 𝑦(𝑡) of the mass. The spring stores elastic potential energy and provides a restoring force proportional to displacement, while the damper dissipates energy and provides a force proportional to velocity, opposing motion. This system is a canonical model in dynamics and control, illustrating how inertia, stiffness, and damping together 
determine transient response, oscillations, resonance, and steady-state behavior under external forcing."
30,Fr,PHYS-30-Fr,ai/data/errorTime.png,"Line graph titled “Error vs Time” showing how a system’s error evolves over time. The horizontal axis represents time, while the vertical axis represents error on a small scale (on the order of 10−3). The error curve exhibits an oscillatory pattern, repeatedly rising to a peak and then dropping close to zero, with each successive peak increasing in magnitude. Early in time, the error remains very small, but as time progresses the oscillations grow larger, reaching their highest values near the end of the plotted interval."
31,Fr,PHYS-31-Fr,ai/data/energyTime.png,"Line graph titled “Energy vs Time” showing the total energy of a system as a function of time. The horizontal axis represents time, while the vertical axis represents energy, which remains close to a constant value around 0.5. The curve oscillates smoothly with small, regular fluctuations, but does not show any long-term increase or decrease in its average level. This behavior indicates that the system’s energy is approximately conserved, with the small oscillations likely arising from periodic exchange between different forms of energy (such as kinetic and potential energy) or from numerical or measurement effects. Overall, the plot 
illustrates a key concept in physics and numerical simulation: in stable, conservative systems, energy remains bounded and nearly constant over time, even though it may oscillate between different components."
32,Fr,PHYS-32-Fr,ai/data/densityTemperature.png,"Line graph titled “Density vs Temperature at Different Pressure.” The horizontal axis represents temperature, while the vertical axis represents density. Two sets of experimental data are shown for pressures P = 2.5 and P = 2.7, each plotted with data points and small error bars, along with corresponding smooth curves representing ideal gas law predictions at those pressures.
For both pressures, density decreases as temperature increases, illustrating the inverse relationship between temperature and density for a gas when pressure is held approximately constant. At every temperature, the curve for P = 2.7 lies above the curve for P = 2.5, indicating that higher pressure results in a higher density at the same temperature, consistent with thermodynamic expectations.
The ideal gas law prediction curves follow the same downward trend and remain close to the measured data, showing good agreement between theory and experiment. Small deviations between the measured points and the ideal curves suggest minor non-ideal effects or experimental uncertainty, but the overall behavior strongly supports the ideal gas model. The graph visually reinforces the physical principle that increasing temperature causes gas particles to spread out, reducing density, while increasing pressure compresses the gas and increases density."
33,Fr,PHYS-33-Fr,ai/data/vectorAddition2.png,"Vector addition of two forces using a head-to-tail construction and their resulting force. The black vectors F₁ and F₂ are drawn sequentially: F₁ acts at an angle θ₂ above the horizontal baseline, and F₂ begins at the head of F₁, rising steeply with its own orientation defined by angle θ₃. The grey diagonal vector Fᵣ represents the resultant force, drawn from the tail of F₁ directly to the head of F₂, showing the net effect of the two forces acting together. Several angles are labeled to clarify the geometry: φ measures the inclination of the resultant relative to the horizontal, θ₁ shows the angle between Fᵣ and F₁, and θ₂ and θ₃ describe the orientations of F₁ and F₂, respectively. 
Educationally, the figure emphasizes that vector addition depends on both magnitude and direction, not just size, and that the resultant force can be found geometrically or analytically using trigonometry or component methods. This construction is commonly used in statics and dynamics to analyze systems where multiple forces act simultaneously on an object."
34,Fr,PHYS-34-Fr,ai/data/inertiaCylinder.png,"This diagram shows a thick (hollow) cylinder used to illustrate how moment of inertia depends on mass distribution relative to the axis of rotation. The cylinder has height h and rotates about its central z-axis, indicated by the vertical arrow. The inner radius r₁ and outer radius r₂ define the hollow region, with dashed vertical lines showing the cylindrical boundaries that contain the material. Physically, this figure emphasizes that rotational inertia is not determined solely by total mass, but by how far that mass lies from the rotation axis: material closer to r₂ contributes more strongly than material near r₁. This is why a thick or hollow cylinder resists changes in rotational motion more than a solid cylinder of the same mass concentrated near the center. 
In mechanics, this geometry leads directly to the moment of inertia expression 𝐼=1/2*𝑀(𝑟*(2/1)+𝑟*(2/2)) for a uniform thick cylinder, making the diagram especially useful for understanding angular acceleration, rotational kinetic energy, and real-world systems like flywheels, pipes, and rotating drums."
35,Fr,PHYS-35-Fr,ai/data/magneticFlux.png,"Magnetic flux through a single current-carrying loop placed in an external magnetic field. The green curved lines represent the magnetic field B, passing through the loop, while the brown oval shows the conducting coil that bounds the surface Σ. The red arrow labeled i indicates the direction of the electric current flowing around the loop, which sets the orientation of the surface normal n (blue arrow) according to the right-hand rule. The magnetic flux Φ through the loop is determined by how much of the magnetic field penetrates the enclosed surface and by the angle between the field and the normal vector, expressed mathematically as Φ=∫B⋅dA. 
Educationally, the diagram highlights that flux is maximized when the magnetic field is aligned with n and reduced when the field is tilted or partially bypasses the surface. This concept is fundamental to electromagnetic induction, explaining how changing magnetic flux through a coil generates an induced voltage, as described by Faraday’s law, and underpins technologies such as generators, transformers, and inductive sensors."
36,Fr,PHYS-36-Fr,ai/data/magneticFlux2.png,"Magnetic flux linking two separate current-carrying coils, illustrating the principle of mutual inductance. The two brown loops, labeled Γ₁ and Γ₂, bound the surfaces Σ₁ and Σ₂, shown in green, with their corresponding outward normal vectors n₁ and n₂ indicated in blue. Currents i₁ and i₂ flow around each loop, establishing magnetic fields whose field lines (green curves) pass through both surfaces. 
The key idea shown is that the magnetic field produced by the current in one coil threads the surface of the other, creating a magnetic flux that couples the two circuits. Educationally, this illustrates how a changing current in coil Γ₁ alters the magnetic flux through Σ₂ and can induce an electromotive force in coil Γ₂, and vice versa, as described by Faraday’s law and quantified by the mutual inductance coefficient. 
This physical coupling underlies the operation of transformers, wireless power transfer, and many inductive sensing and communication systems."
37,Fr,PHYS-37-Fr,ai/data/magneticCurrent.png,"The theoretical concept of magnetic current 𝑀, represented by circulating orange loops, producing an associated electric field 𝐸, shown by the green arrows pointing to the right. In this visualization, magnetic current is treated as if it were a flow of magnetic monopoles, even though such monopoles have not been observed in nature. The orientation of the electric field relative to the magnetic current follows a left-hand rule, emphasizing the symmetry that would exist between electricity and magnetism if magnetic charges were real. 
This diagram is used to extend Maxwell’s equations into a symmetric form, helping students understand electromagnetic duality: just as electric currents generate magnetic fields, hypothetical magnetic currents would generate electric fields. This perspective is especially valuable in advanced electromagnetism, antenna theory, and computational modeling, where magnetic currents serve as powerful mathematical tools for analyzing radiation, boundary conditions, and wave propagation, even though they are not physically realized."
38,Fr,PHYS-38-Fr,ai/data/kineticTheory.png,"The kinetic theory of gases, showing gas particles as small spheres moving randomly within a container, each leaving a faint trail that represents its recent motion. The particles travel in straight lines between collisions, changing direction only when they collide with other particles or the container walls. The variation in trail length and direction indicates that particles have a range of speeds and move isotropically, reflecting the microscopic origin of temperature as a measure of average kinetic energy.
The diagram emphasizes that gas pressure arises from countless elastic collisions with the container walls, while macroscopic properties like pressure, temperature, and volume emerge statistically from this chaotic microscopic motion. It also highlights key assumptions of the kinetic model: particles are far apart, intermolecular forces are negligible except during collisions, and total kinetic energy increases as temperature rises."
