Diagram-ID,Page-Number,Image-Index,Image-Path,Modified-Alt-Text
290,473,0,ai/data/page0473_img000.png,"the visible portion of the electromagnetic spectrum showing how visible light fits between infrared and ultraviolet radiation. The visible spectrum is labeled by color from red to violet, with wavelengths decreasing from about 700 nanometers (nm) for red light to about 400 nanometers (nm) for violet light. The diagram illustrates that color is determined by wavelength, with longer wavelengths corresponding to red light and shorter wavelengths corresponding to violet light, and highlights that the boundaries between infrared, visible light, and ultraviolet are gradual rather than sharply defined."
291,474,0,ai/data/page0474_img000.png,"Side-by-side diagrams comparing subtractive and additive color mixing. On the left, the subtractive color model for pigments shows cyan, magenta, and yellow overlapping to form darker colors, with all three combining to produce black due to absorption of light. On the right, the additive color model for light shows red, green, and blue overlapping to create brighter colors, with all three combining to produce white light, illustrating the fundamental difference between pigment mixing and light mixing."
292,475,0,ai/data/page0475_img000.png,"Comparison of visible wavelength ranges perceived by humans, bees, and dogs along a wavelength axis from about 300 to 700 nanometers. Humans perceive visible light from roughly violet to red, bees can see ultraviolet light in addition to part of the visible spectrum but not red, and dogs perceive a narrower range of colors with reduced sensitivity to reds and greens. The figure illustrates that different species experience color differently because their eyes contain different types and numbers of photoreceptor cells."
294,478,0,ai/data/page0478_img000.png,"thin-film interference in optics. An incident light ray strikes the top surface of a thin film with refractive index n2 between two media n1 and n3. Part of the light reflects immediately at the top surface (ray 1), while the rest refracts into the film, reflects off the bottom surface, and exits as ray 2. The two reflected rays travel different optical path lengths, causing constructive or destructive interference depending on the film thickness t, wavelength of light, and refractive indices. This phenomenon explains effects such as color patterns in soap bubbles and the reduction of glare by polarized sunglasses."
295,478,1,ai/data/page0478_img001.png,"polarization of transverse waves using a rope analogy. In panel (a), the rope oscillates in a vertical plane, representing vertically polarized waves that can pass through a vertical slit. In panel (b), the rope oscillates in a horizontal plane, representing horizontally polarized waves that are blocked by a vertical slit. The diagram illustrates that polarization describes the direction of oscillation perpendicular to the direction of wave travel, and that filters or slits only transmit waves polarized in the same direction, a principle that also applies to light waves."
297,481,0,ai/data/page0481_img000.png,"the inverse square law for electromagnetic radiation. A point source emits light that spreads outward uniformly, forming larger spherical surfaces as the distance from the source increases. At distances r, 2r, and 3r, the same amount of radiant energy is distributed over increasingly larger surface areas, causing the intensity or illuminance to decrease with distance. The diagram shows that as the radius of the spherical surface increases, the energy per unit area decreases proportionally to one over the distance squared, explaining why light appears dimmer the farther it travels from its source."
299,492,0,ai/data/page0492_img000.png,"the ways light travels from a source to an observer. Light from the Sun travels through empty space to reach Earth and then continues through different media such as air and glass. In the scene, sunlight enters a window, where it partially transmits through the glass and partially reflects off surfaces before reaching a person’s eyes. The dashed and solid arrows represent straight-line paths of light rays, emphasizing that light propagates in straight lines unless it reflects or changes direction when moving between different materials."
300,493,0,ai/data/page0493_img000.png,"illustrating the law of reflection. An incident light ray strikes a flat surface and reflects away symmetrically on the opposite side of a dashed line that represents the normal, which is perpendicular to the surface. The angle of incidence (θᵢ) is measured between the incoming ray and the normal, and the angle of reflection (θᵣ) is measured between the reflected ray and the normal. The diagram shows that these two angles are equal, demonstrating that light reflects so that the incident ray, reflected ray, and the normal all lie in the same plane."
301,493,1,ai/data/page0493_img001.png,"Diffuse reflection from a rough surface. Several parallel light rays strike an uneven surface, where each small section has a different orientation. As a result, the incoming rays are reflected in many different directions rather than one single direction. This contrasts with reflection from a smooth surface, where rays reflect uniformly. Diffuse reflection explains why rough objects are visible from many viewing angles but do not form clear mirror-like ai/data."
302,494,0,ai/data/page0494_img000.png,"image formation by a flat mirror. Light rays from a bottle reflect off the flat mirror and enter the observer’s eye, obeying the law of reflection where the angle of incidence equals the angle of reflection. The reflected rays diverge, but when traced backward as dashed lines, they appear to originate from a point behind the mirror, forming a virtual image. The diagram shows that the image distance di behind the mirror is equal to the object distance do in front of the mirror, explaining why flat mirrors produce upright ai/data that appear the same size as the object but cannot be projected onto a screen."
306,496,0,ai/data/page0496_img000.png,"Comparison of concave and convex mirrors and their focal lengths. In the concave mirror (left), parallel incoming light rays reflect and converge at a focal point F located in front of the mirror, giving the mirror a positive focal length f. This converging behavior allows concave mirrors to form real or virtual ai/data depending on the object’s position relative to the focal point. In the convex mirror (right), parallel rays reflect and diverge outward, appearing to originate from a focal point F located behind the mirror, which is indicated as a negative focal length. Convex mirrors always form virtual, upright, and reduced ai/data because reflected rays never actually meet in front of the mirror."
307,496,1,ai/data/page0496_img001.png,"Image formation for concave and convex mirrors. In (a), an object placed outside the focal point of a concave mirror reflects rays that converge in front of the mirror, forming a real, inverted image on the same side as the object. In (b), when the object is inside the focal point of a concave mirror, the reflected rays diverge and appear to originate from behind the mirror, producing a virtual, upright, and magnified image. In (c), a convex mirror reflects rays that always diverge, regardless of object position, so the image is always virtual, upright, and reduced, appearing behind the mirror."
309,498,1,ai/data/page0498_img001.png,"a Schmidt–Cassegrain telescope illustrating how incoming parallel light from a distant object enters the telescope, reflects off the large concave primary mirror, then reflects from a smaller convex secondary mirror before being brought to focus at the focal plane near the observer’s eye. This folded optical path allows the telescope to have a long effective focal length while remaining physically compact. The design improves light-gathering power and image clarity, making it widely used in astronomical observations to view faint and distant objects such as planets, stars, and galaxies."
310,498,2,ai/data/page0498_img002.png,"a car headlight or spotlight uses a parabolic mirror to control light direction. The bulb is placed at the focal point of the parabolic mirror, so light rays emitted in all directions reflect off the mirror and emerge as parallel rays. This produces a bright, focused beam that travels long distances without spreading out significantly. The same physical principle is used in solar collectors, where sunlight is reflected and concentrated at a focal point to produce heat for energy generation, demonstrating how mirror geometry controls light propagation and energy concentration."
312,499,0,ai/data/page0499_img000.png,"Ray diagram illustrating image formation by a concave mirror and the variables used in mirror and lens calculations. The object is placed at a distance do from the mirror with height ho, while the image forms at distance di with height hi. Rays are drawn using standard construction rules: one ray travels parallel to the principal axis and reflects through the focal point F, another passes through the focal point and reflects parallel to the axis, and a third reflects symmetrically about the normal. These rays intersect to locate the image position and size. The focal length f characterizes the mirror’s curvature and determines how strongly it converges light. The relationships among do, di, and f are described by the mirror (lens) equation, which is used to predict image location and magnification in optical systems such as mirrors, lenses, telescopes, and cameras."
313,502,0,ai/data/page0502_img000.png,"refraction at the boundary between water and air using a fish tank example. Light rays emitted from the fish bend as they pass from water into air because the speed of light changes between the two media. As a result, the rays follow different paths to the observer’s eye, making the fish appear to be in a different position than its true location. This apparent shift occurs because the brain assumes light travels in straight lines and traces the refracted rays backward into the water. Refraction depends on the indices of refraction of the two media and is governed by Snell’s law. This effect explains common optical illusions such as objects appearing closer or displaced in water and is important in applications like lenses, eyeglasses, microscopes, and underwater viewing."
314,504,0,ai/data/page0504_img000.png,"a lawnmower analogy to explain refraction and Snell’s law. The image compares the behavior of a light ray crossing a boundary between two media with different refractive indices to a lawnmower moving from a sidewalk onto grass. In medium 1 (sidewalk), the mower moves faster, just as light travels faster in a medium with a lower refractive index. When the mower enters the grass (medium 2), one wheel slows down first, causing the mower to turn toward the perpendicular; similarly, when light enters a medium where it travels more slowly, it bends toward the normal. In the reverse situation, when moving from grass to sidewalk, the mower speeds up and turns away from the perpendicular, just as light bends away from the normal when it enters a faster medium. This analogy helps visualize how changes in wave speed cause refraction at a boundary and why the angle of refraction depends on the properties of the two media."
315,506,0,ai/data/page0506_img000.png,"Two panels are shown to demonstrate the refraction and dispersion of light by a glass prism. In panel (a), a single wavelength (pure λ) enters the prism and bends at each glass–air boundary due to the change in speed of light inside the glass. Because only one wavelength is present, the light emerges as a single ray with a new direction. In panel (b), white light enters the prism and is separated into its component colors. This occurs because the index of refraction of glass depends on wavelength, so different colors travel at different speeds inside the prism and bend by different amounts. Shorter wavelengths (violet, around 380 nm) experience a larger refractive index and bend more, while longer wavelengths (red, around 760 nm) bend less. This wavelength-dependent bending is called dispersion and explains phenomena such as rainbows and the separation of colors in optical instruments."
316,506,1,ai/data/page0506_img001.png,"Demonstration of how a rainbow is formed by sunlight interacting with a water droplet. Incoming sunlight enters the droplet and slows down, causing refraction at the air–water boundary. Because the index of refraction of water depends on wavelength, different colors bend by different amounts, with violet bending more than red. After entering the droplet, part of the light reflects off the inner back surface of the droplet. The reflected light then exits the droplet and is refracted a second time as it returns to air, increasing the separation of colors. As a result, red light exits at a larger angle relative to the incoming sunlight, while violet light exits at a smaller angle. When many droplets are present in the atmosphere, each droplet sends a specific color toward the observer, producing the circular arc of colors known as a rainbow."
317,507,0,ai/data/page0507_img000.png,"refraction, the critical angle, and total internal reflection at the boundary between two media with different indices of refraction. In panel (a), a light ray travels from a medium with higher index of refraction (n1) into a medium with lower index of refraction (n2). Because light speeds up when entering the lower-index medium, the refracted ray bends away from the normal (the perpendicular to the surface). The angles of incidence and refraction are measured relative to this normal. In panel (b), the incident angle is increased until the refracted ray travels exactly along the boundary between the two media. This incident angle is called the critical angle, and at this angle the refracted angle is 90 degrees. In panel (c), the incident angle is greater than the critical angle, so refraction no longer occurs. Instead, all the light is reflected back into the original medium, a phenomenon known as total internal reflection. This effect is explained by Snell’s law and is the physical principle behind technologies such as fiber-optic cables and light guides."
318,508,0,ai/data/page0508_img000.png,"Demonstration of how total internal reflection causes diamonds to sparkle. Light entering the diamond from air slows down and bends toward the normal because diamond has a much higher index of refraction than air. When the light reaches an internal surface of the diamond at an angle greater than the critical angle, it cannot refract out into the air. Instead, it undergoes total internal reflection and is reflected entirely back into the diamond. Because the critical angle for a diamond–air boundary is very small, most light rays striking the internal faces are totally reflected multiple times. Diamond facets are carefully cut so that these internally reflected rays are directed back out through the top of the diamond toward the observer. This trapping and controlled release of light increases brightness, intensity, and sparkle, which is why diamonds appear exceptionally brilliant compared to other gemstones."
319,508,1,ai/data/page0508_img001.png,"binoculars use prisms and total internal reflection to redirect light toward the observer’s eyes. Light rays entering the binoculars travel into glass prisms, where they strike internal surfaces at angles greater than the critical angle. Instead of refracting out of the prism, the light undergoes total internal reflection, allowing it to be reflected efficiently without the energy loss that occurs with metallic mirrors. The prisms are arranged as corner reflectors, which reverse and reorient the image so it appears upright and correctly oriented to the viewer. This optical path also allows binoculars to be compact while maintaining a long effective light path for magnification. The same physical principle is used in fiber-optic cables, where light is guided through glass or plastic fibers by repeated total internal reflection, enabling high-speed transmission of data for internet, telephone, and cable television systems."
320,509,0,ai/data/page0509_img000.png,"optical fibers guide light using total internal reflection. Each fiber consists of a central core with a higher index of refraction (n₁) surrounded by cladding with a lower index of refraction (n₂). When light enters the core at a suitable angle, it strikes the core–cladding boundary at angles greater than the critical angle, causing total internal reflection rather than refraction out of the fiber. As a result, the light is confined within the core and can travel long distances with very little loss. Even when the fiber bends, the light continues to reflect internally and follows the curved path, allowing signals to propagate around corners. This principle enables fiber-optic communication systems, which transmit data as pulses of light for internet, telephone, and cable networks, offering high bandwidth, low signal loss, and immunity to electrical interference."
322,513,0,ai/data/page0513_img000.png,"a convex (converging) lens bends light rays and brings them to a focal point. Light rays that enter the lens parallel to the principal axis are refracted at both curved surfaces of the lens and converge at a single point called the focal point (F). The distance from the center of the lens to this focal point is the focal length (f), which is a key property of the lens and determines how strongly it bends light. Ray 2 travels along the axis and passes straight through the lens with minimal deviation, while rays 1 and 3 bend toward the axis due to refraction. The enlarged view on the right shows how refraction occurs at each surface according to Snell’s law, with different angles of incidence and refraction as the light enters and exits the lens. This behavior explains how convex lenses are used in devices such as cameras, microscopes, glasses for farsightedness, and the human eye to focus light and form clear ai/data."
323,513,1,ai/data/page0513_img001.png,"a concave (diverging) lens affects incoming light rays. Rays that enter the lens parallel to the principal axis spread outward after passing through the lens instead of converging. Because the rays diverge, they appear to originate from a focal point (F) located on the same side of the lens as the incoming light. For this reason, the focal length f is defined as negative for a diverging lens. Ray 2 travels along the axis and passes through the center of the lens with minimal bending, while rays 1 and 3 bend away from the axis due to refraction at both lens surfaces. The dashed lines indicate the apparent paths of the rays, not the actual light paths, and are used to locate the virtual focal point. The enlarged view illustrates how Snell’s law governs the change in direction at each surface, with different angles of incidence and refraction. Concave lenses are commonly used in applications such as glasses for nearsightedness, where they spread incoming light so that ai/data focus correctly on the retina."
324,515,0,ai/data/page0515_img000.png,"a converging convex lens showing how a real image is formed. Three light rays originate from the top of an object. Ray 1 travels parallel to the principal axis and refracts through the focal point on the far side of the lens. Ray 2 passes through the center of the lens and continues in a straight line without bending. Ray 3 travels through the focal point on the object side of the lens and emerges parallel to the axis after refraction. The refracted rays intersect on the opposite side of the lens, forming a real inverted image. The diagram labels object distance (do), image distance (di), focal length (f), object height (ho), and image height (hi), illustrating how lens geometry determines image location and magnification."
326,518,0,ai/data/page0518_img000.png,"This is a two part diagram. In part (a), a Galilean telescope uses a convex objective lens and a concave eyepiece. Incoming parallel rays from a distant object enter the objective lens and begin to converge. Before the rays reach a real focus, they pass through the concave eyepiece, which causes the rays to emerge parallel again toward the eye. The final image is upright, virtual, and viewed at infinity, making this design suitable for spyglasses. In part (b), a simple astronomical telescope uses two convex lenses. Light from a very distant object enters the convex objective lens and forms a real, inverted intermediate image of height (hi) at the focal plane of the objective, labeled by the focal length (fo). This intermediate image acts as the object for the eyepiece. The eyepiece, with focal length (fe), produces a magnified virtual final image that is viewed by the eye. Angular directions before and after the eyepiece are indicated by (theta) and (theta prime), showing how the telescope increases angular magnification. The positions of focal points (Fo), (Fe), and (Fe prime) are labeled to show the optical alignment of the system."
327,519,0,ai/data/page0519_img000.png,"a compound microscope consisting of two lenses: an objective lens and an eyepiece. A small object of height (ho) is placed just beyond the focal point (Fo) of the objective lens at a distance (do). Rays from the object pass through the objective lens and form a real, inverted, and magnified first image of height (hi) at a distance (di). This first image lies near the focal point (Fe) of the eyepiece and serves as the object for the eyepiece lens. The eyepiece acts as a magnifying glass and produces a final virtual image of height (hi prime), which is magnified even further and viewed by the eye. The dashed backward extensions of the rays indicate the apparent position of the final image on the same side of the eyepiece as the object. Distances between lenses and ai/data, including (do), (di), and (di prime), are labeled along the optical axis. The diagram emphasizes idealized ray behavior, while noting that real lenses introduce aberrations, which are distortions that cause ai/data to deviate from the predictions of thin-lens ray diagrams."
328,519,1,ai/data/page0519_img001.png,"This is a two part diagram of chromatic aberration and its correction in lens systems. In part (a), white light rays pass through a single convex lens and are separated into different colors due to the wavelength dependence of the lens’s index of refraction. Violet light (V) is bent more strongly than red light (R), causing violet rays to focus closer to the lens and red rays to focus farther away. As a result, the image formed from white light appears spread out with different colors focusing at different positions, producing color fringes and changes in magnification. In part (b), a multiple-lens system is shown reducing chromatic aberration. White light rays pass through a combination of lenses made from different materials or shapes, causing the different colors to refract in a way that brings them closer to a common focus. This partial correction reduces color separation in the final image. The diagram highlights that while chromatic aberration can be mitigated using compound lenses, such systems increase the complexity and cost of optical devices such as cameras and microscopes."
329,520,0,ai/data/page0520_img000.png,"the human eye and how ai/data are formed on the retina. Light enters the eye through the cornea, which provides a large portion of the eye’s refractive power, and then passes through the aqueous humor to the adjustable lens. The lens changes shape to focus light from objects at different distances, allowing a sharp real image to form on the retina. Behind the lens, light travels through the vitreous humor before reaching the retina. The retina contains light-sensitive receptors, with the highest concentration located at the fovea, which is responsible for sharp central vision. The optic nerve exits the eye at the optic disc, creating a blind spot where no receptors are present. Other labeled structures include the iris, which controls the amount of light entering the eye, the ciliary fibers, which adjust the lens shape, and the sclera, which forms the protective outer layer of the eye. The diagram emphasizes the importance of refractive indices in image formation, particularly the large change in refractive index at the cornea–air interface, which plays a key role in focusing light onto the retina."
330,521,0,ai/data/page0521_img000.png,"image formation in the human eye using ray tracing. Light rays from the top and bottom of an object enter the eye and are refracted first at the cornea, where the greatest bending occurs, and again as they pass into and out of the lens. These rays converge to form a real, inverted image on the retina. Rays labeled (1) and (2) originate from one point on the object, while rays (3) and (4) originate from another point, demonstrating how different points on the object map to corresponding points on the retinal image. The diagram shows that the image distance (di) must equal the fixed distance from the lens to the retina in order for the image to be sharply focused. Because the lens-to-retina distance does not change, the eye achieves clear vision by adjusting the focal length of the lens rather than moving the retina. The object distance is drawn smaller than scale to emphasize the focusing behavior rather than the true geometry of the eye."
