Diagram-ID,Page-Number,Image-Index,Image-Path,Caption,Width,Height,Modified-Alt-Text
347,543,1,images/page0543_img001.png,Figure 17.11 (a) Single-slit diffraction pattern. Monochromatic light passing through a single slit produces a central maximum and many smaller and dimmer maxima on either side. The central maximum is six times higher than shown. (b) The drawing shows the bright central maximum and dimmer and thinner maxima on either side. (c) The location of the minima are shown in terms of and D. The analysis of single-slit diffraction is illustrated in Figure 17.12. Assuming the screen is very far away compar,731,346,
348,544,0,images/page0544_img000.png,"Figure 17.12 Equations for a single-slit diffraction pattern, where λ is the wavelength of light, D is the slit width, is the angle between a line from the slit to a minimum and a line perpendicular to the screen, L is the distance from the slit to the screen, y is the distance from the center of the pattern to the minimum, and m is a nonzero integer indicating the order of the minimum. Below we summarize the equations needed for the calculations to follow. The speed of light in a vacuum, c, the",486,284,
349,547,0,images/page0547_img000.png,"Figure 17.13 A diffraction grating consists of a large number of evenly-spaced parallel slits. (a) Light passing through the grating is diffracted in a pattern similar to a double slit, with bright regions at various angles. (b) The pattern obtained for white light incident on a grating. The central maximum is white, and the higher-order maxima disperse white light into a rainbow of colors.",300,357,
350,548,0,images/page0548_img000.png,"Figure 17.14 (a) This Australian opal and (b) the butterfly wings have rows of reflectors that act like reflection gratings, reflecting different colors at different angles. (credit: (a) Opals-On-Black.com, via Flickr (b) whologwhy, Flickr)",487,239,
351,548,1,images/page0548_img001.png,"Figure 17.15 Idealized graphs of the intensity of light passing through a double slit (a) and a diffraction grating (b) for monochromatic light. Maxima can be produced at the same angles, but those for the diffraction grating are narrower, and hence sharper. The maxima become narrower and the regions between become darker as the number of slits is increased. Snap Lab Diffraction Grating • A CD (compact disc) or DVD",300,484,
354,550,1,images/page0550_img001.png,"Figure 17.18 The diagram shows the function of a diffraction grating in a spectroscope. Light diffracts as it moves through space, bending around obstacles and interfering constructively and destructively. While diffraction allows light to be used as a spectroscopic tool, it also limits the detail we can obtain in images. Figure 17.19 (a) shows the effect of passing light through a small circular aperture. Instead of a bright spot with sharp edges, a spot with a fuzzy edge surrounded by circles ",299,134,
355,551,0,images/page0551_img000.png,"Figure 17.19 (a) Monochromatic light passed through a small circular aperture produces this diffraction pattern. (b) Two point light sources that are close to one another produce overlapping images because of diffraction. (c) If they are closer together, they cannot be resolved, that is, distinguished. How does diffraction affect the detail that can be observed when light passes through an aperture? Figure 17.19 (b) shows the diffraction pattern produced by two point light sources that are close",487,165,
356,552,0,images/page0552_img000.png,"Figure 17.20 (a) Graph of intensity of the diffraction pattern for a circular aperture. Note that, similar to a single slit, the central maximum is wider and brighter than those to the sides. (b) Two point objects produce overlapping diffraction patterns. Shown here is the Rayleigh criterion for their being just resolvable. The central maximum of one pattern lies on the first minimum of the other.",488,395,
358,564,0,images/page0564_img000.png,"Figure 18.2 A glass rod becomes positively charged when rubbed with silk, whereas the silk becomes negatively charged. (a) The glass rod is attracted to the silk, because their charges are opposite. (b) Two similarly charged glass rods repel. (c) Two similarly charged silk cloths repel. It took scientists a long time to discover what lay behind these two types of charges. The word electric itself comes from the Greek word elektron for amber, because the ancient Greeks noticed that amber, when ru",731,205,
359,565,0,images/page0565_img000.png,"Figure 18.3 The left drawing shows Thompson’s plum-pudding model, in which the electrons swim around in a nebulous mass of positive charge. The right drawing shows Rutherford’s model, in which the electrons orbit around a tiny, massive nucleus. Note that the size of the nucleus is vastly exaggerated in this drawing. Were it drawn to scale with respect to the size of the electron orbits, the nucleus would not be visible to the naked eye in this drawing. Also, as far as science can currently detec",477,234,
360,566,0,images/page0566_img000.png,"Figure 18.4 The oil-drop experiment involved spraying a fine mist of oil between two metal plates charged with opposite charges. By knowing the mass of the oil droplets and adjusting the electric charge on the plates, the charge on the oil drops can be determined with precision. Millikan and Fletcher found that the drops would accumulate charge in discrete units of about which is within 1 percent of the modern value of Although this difference may seem quite small, it is actually five times grea",301,329,
361,567,0,images/page0567_img000.png,"Figure 18.5 Procedure for Part (b) 5. Stick one piece of tape on the nonmetallic surface, and stick the second piece of tape on top of the first piece, as shown in Figure 18.6(a). 6. Slowly peel off the two pieces by pulling on the handle of the bottom piece. 7. Gently stroke your finger along the top of the second piece of tape (i.e., the nonsticky side), as shown in Figure 18.6(b). 8. Peel the two pieces of tape apart by pulling on their handles, as shown in Figure 18.6(c).",488,157,
362,567,1,images/page0567_img001.png,"Figure 18.6 GRASP CHECK In step 4, why did the two pieces of tape repel each other? In step 9, why did they attract each other? a. Like charges attract, while unlike charges repel each other. b. Like charges repel, while unlike charges attract each other. c. Tapes having positive charge repel, while tapes having negative charge attract each other. d Tapes having negative charge repel while tapes having positive charge attract each other",488,157,
363,568,0,images/page0568_img000.png,"Figure 18.7 Two spheres, one blue and one red, initially have +4 C and +8 C of charge, respectively. After the two spheres interact, the blue sphere has a charge of +10 C. The law of conservation of charge allows us to find the final charge on the red sphere. Discussion Like all conservation laws, conservation of charge is an accounting scheme that helps us keep track of electric charge. Practice Problems",298,183,
364,569,0,images/page0569_img000.png,"Figure 18.8 Materials can be arranged according to their ability to conduct electric charge. The slashes on the arrow mean that there is a very large gap in conducting ability between conductors, semiconductors, and insulators, but the drawing is compressed to fit on the page. The numbers below the materials give their resistivity in Ω•m (which you will learn about below). The resistivity is a measure of how hard it is to make charge move through a given material. What happens if an excess negat",732,307,
365,570,0,images/page0570_img000.png,"Figure 18.9 (a) A conducting sphere with excess negative charge (i.e., electrons). The electrons repel each other and spread out to cover the outer surface of the sphere. (b) An insulating sphere with excess negative charge. The electrons cannot move, so they remain in their original positions. Transfer and Separation of Charge Most objects we deal with are electrically neutral, which means that they have the same amount of positive and negative charge. However, transferring negative charge from",300,179,
366,571,0,images/page0571_img000.png,"Figure 18.10 In the top row, a metal sphere with 100 excess electrons transfers 25 electrons to a metal sphere with an excess of 50 electrons. After the transfer, both spheres have 75 excess electrons. In the bottom row, a metal sphere with 100 excess protons receives 25 electrons from a ball with 50 excess protons. After the transfer, both spheres have 75 excess protons. In this discussion, you may wonder how the excess electrons originally got from your shoes to your hand to create the spark w",486,363,
367,572,0,images/page0572_img000.png,"Figure 18.11 (a) Two neutral conducting spheres are touching each other, so the charge is evenly spread over both spheres. (b) A positively charged rod approaches, which attracts negative charges, leaving excess positive charge on the right sphere. (c) The spheres are separated. Each sphere now carries an equal magnitude of excess charge. (d) When the positively charged rod is removed, the excess negative charge on the left sphere is attracted to the excess positive charge on the right sphere. F",300,650,
368,573,0,images/page0573_img000.png,"Figure 18.12 Van de Graaff generators transfer electrons onto a metallic sphere, where the electrons distribute themselves uniformly over the outer surface. Van de Graaff generators are used to demonstrate many interesting effects caused by static electricity. By touching the globe, a person gains excess charge, so his or her hair stands on end, as shown in Figure 18.13. You can also create mini lightning bolts by moving a neutral conductor toward the globe. Another favorite is to pile up alumin",441,397,
370,575,0,images/page0575_img000.png,Figure 18.14 Electrons from an electron gun charge a passing ink droplet. STRATEGY A single electron carries a charge of . Dividing the net charge of the ink droplet by the charge of a single electron will give the number of electrons captured by the ink droplet. Solution The number n of electrons captured by the ink droplet are,289,394,
371,577,0,images/page0577_img000.jpeg,"Figure 18.15 A drawing of Coulomb’s torsion balance, which he used to measure the electrical force between charged spheres. (credit: Charles-Augustin de Coulomb) Combining these two proportionalities, he proposed the following expression to describe the force between the charged spheres.hh 18.7",300,386,
372,577,1,images/page0577_img001.png,"Figure 18.16 The magnitude of the electrostatic force F between point charges q1 and q2 separated by a distance r is given by Coulomb’s law. Note that Newton’s third law (every force exerted creates an equal and opposite force) applies as usual—the force (F1,2) on q1 is equal in magnitude and opposite in direction to the force (F2,1) it exerts on q2. (a) Like charges. (b) Unlike charges. Note that Coulomb’s law applies only to charged objects that are not moving with respect to each other. The l",488,136,
373,582,0,images/page0582_img000.png,"Figure 18.17 Three-dimensional representation of the electric field generated by a positive charge. Just drawing the electric field lines in a plane that slices through the charge gives the two-dimensional electric-field maps shown in Figure 18.18. On the left is the electric field created by a positive charge, and on the right is the electric field created by a negative charge. Notice that the electric field lines point away from the positive charge and toward the negative charge. Thus, a posit",267,217,
374,582,1,images/page0582_img001.png,"Figure 18.18 Electric field lines from two point charges. The red point on the left carries a charge of +1 nC, and the blue point on the right carries a charge of –1 nC. The arrows point in the direction that a positive test charge would move. The field lines are denser as you approach the point charge. Electric-field maps can be made for several charges or for more complicated charge distributions. The electric field due to multiple charges may be found by adding together the electric field fro",486,191,
375,583,0,images/page0583_img000.png,Figure 18.19 (a) The electric field generated by a positive point charge (left) and a negative point charge of the same magnitude (right). (b) The electric field generated by two equal negative charges. Virtual Physics Probing an Electric Field Click to view content (http://www.openstax.org/l/28charge-field) This simulation shows you the electric field due to charges that you place on the screen Start by clicking the top checkbox in,300,545,
376,584,0,images/page0584_img000.png,Figure 18.20 Map of electric field due to three charged particles. STRATEGY We know the electric field extends out from positive charge and terminates on negative charge. We also know that the number of electric field lines that touch a charge is proportional to the charge. Charge 1 has 12 fields coming out of it. Charge 2 has six field lines going into it. Charge 3 has 12 field lines going into it. Solution Th l t i fi ld li t f h it i iti h Th l t i fi ld li i t h d th,293,244,
377,585,0,images/page0585_img000.png,"If the diameter of the doorknob is 5.0 cm, its radius is 2.5 cm. We want to know the electric field 1.0 cm from the surface of the",291,307,
378,587,0,images/page0587_img000.png,"Figure 18.21 On the left, the gravitational field points toward Earth. The higher the ball is in the gravitational field, the higher the potential energy is of the Earth-ball system. On the right, the electric field points toward a negative charge. The farther the positive charge is from the negative charge, the higher the potential energy is of the two-charge system. Let’s use the symbol to denote gravitational potential energy. When a mass falls in a gravitational field, its gravitational pote",484,382,
379,588,0,images/page0588_img000.png,"Figure 18.22 In the top picture, a mass accelerates due to a constant electric field. In the bottom picture, the mass accelerates due to a constant gravitational field. WATCH PHYSICS Analogy between Gravity and Electricity This video discusses the analogy between gravitational potential energy and electric potential energy. It reviews the concepts ofi",300,338,
380,589,0,images/page0589_img000.png,"Figure 18.23 The potential energy depends on the sign of the charges and their separation. The arrows on the charges indicate the direction in which the charges would move if released. When charges with the same sign are far apart, their potential energy is low, as shown in the top panel for two positive charges. The situation is the reverse for charges of opposite signs, as shown in the bottom panel. Electric Potential Recall that to find the force applied by a fixed charge Q on any arbitrary t",731,434,
381,590,0,images/page0590_img000.png,"Figure 18.24 The potential at the red point is simply the sum of the potentials due to each individual charge. Now let’s consider the electric potential in a uniform electric field. From the equation , we see that the potential difference in going from to in a uniform electric field E is TIPS FOR SUCCESS 18.29",197,322,
383,592,0,images/page0592_img000.png,"Figure 18.26 In an X-ray tube, a large current flows through the electron source, causing electrons to be ejected from the electron source. The ejected electrons are accelerated toward the target by the electric field. When they strike the target, X-rays are produced. STRATEGY FOR (A) Use the equation to find the potential difference given a constant electric field. Define the source position as and the target position as . To accelerate the electrons in the positive x direction, the electric fi",473,258,
384,593,0,images/page0593_img000.png,The charge on the doorknob is and the charge on the speck of dust is,290,268,
385,595,0,images/page0595_img000.png,"Figure 18.27 The red dots are positive charges, and the blue dots are negative charges. The electric-field direction is shown by the red arrows. Notice that the electric field between the positive and negative dots is fairly uniform. We can extend this idea even further and into two dimensions by placing two metallic plates face to face and charging one with positive charge and the other with an equal magnitude of negative charge. This can be done by connecting one plate to the positive terminal",283,410,
386,596,0,images/page0596_img000.png,"Figure 18.28 Two parallel metal plates are charged with opposite charge, by connecting the plates to the opposite terminals of a battery. The magnitude of the charge on each plate is the same. Let’s think about the work required to charge these plates. Before the plates are connected to the battery, they are neutral—that is, they have zero net charge. Placing the first positive charge on the left plate and the first negative charge on the right plate requires very little work, because the plates",291,775,
388,600,0,images/page0600_img000.png,"Figure 18.30 The top and bottom capacitors carry the same charge Q. The top capacitor has no dielectric between its plates. The bottom capacitor has a dielectric between its plates. The molecules in the dielectric are polarized by the electric field of the capacitor. All electrically insulating materials are dielectrics, but some are better dielectrics than others. A good dielectric is one whose molecules allow their electrons to shift strongly in an electric field. In other words, an electric f",483,1003,
389,602,0,images/page0602_img000.png,"Figure 18.31 The top and bottom capacitors carry the same charge Q. The top capacitor has no dielectric between its plates. The bottom capacitor has a dielectric between its plates. Because some electric-field lines terminate and start on polarization charges in the dielectric, the electric field is less strong in the capacitor. Thus, for the same charge, a capacitor stores less energy when it contains a dielectric. WORKED EXAMPLE Capacitor for Camera Flash",483,1004,
390,617,0,images/page0617_img000.png,"Figure 19.1 Electric energy in massive quantities is transmitted from this hydroelectric facility, the Srisailam power station located along the Krishna River in India, by the movement of charge—that is, by electric current. (credit: Chintohere, Wikimedia Commons) Chapter Outline",975,518,
391,618,0,images/page0618_img000.png,"Figure 19.2 A battery has a wire connecting the positive and negative terminals, which allows electrons to move from the negative terminal to the positive terminal. Electric current is the rate at which electric charge moves. A large current, such as that used to start a truck engine, moves a large amount very quickly, whereas a small current, such as that used to operate a hand-held calculator, moves a small amount of charge more slowly. In equation form, electric current I is defined as",238,272,
392,619,0,images/page0619_img000.png,"Figure 19.3 The electric current moving through this wire is the charge that moves past the cross-section A divided by the time it takes for this charge to move past the section A. Assume each particle q in Figure 19.3 carries a charge , in which case the total charge shown would be . If these charges move past the area A in a time , then the current would be 19.1",300,168,
393,619,1,images/page0619_img001.png,"Figure 19.4 (a) The electric field points to the right, the current moves to the right, and positive charges move to the right. (b) The equivalent situation but with negative charges moving to the left. The electric field and the current are still to the right. Snap Lab Vegetable Current This lab helps students understand how current works. Given that particles confined in a pipe cannot occupy the same space pushing more particles into one end of the pipe will force the same number of particles ",300,468,
394,620,0,images/page0620_img000.png,"Figure 19.5 Free electrons moving in a conductor make many collisions with other electrons and atoms. The path of one electron is shown. The average velocity of free electrons is in the direction opposite to the electric field. The collisions normally transfer energy to the conductor, so a constant supply of energy is required to maintain a steady current. So far, we have discussed current that moves constantly in a single direction. This is called direct current, because the electric charge flo",488,247,
395,621,0,images/page0621_img000.png,"Figure 19.6 With alternating current, the direction of the current reverses at regular time intervals. The graph on the top shows the current versus time. The negative maxima correspond to the current moving to the left. The positive maxima correspond to current moving to the right. The current alternates regularly and smoothly between these two maxima. Devices that use AC include vacuum cleaners, fans, power tools, hair dryers, and countless others. These devices obtain the power they require w",725,401,
396,624,0,images/page0624_img000.png,Ohm’s law tells us . The voltage drop in going through the headlight is just the voltage rise supplied by,302,286,
397,625,0,images/page0625_img000.png,"Figure 19.7 The line shows the current as a function of voltage. Notice that the current is given in milliamperes. For example, at 3 V, the current is 0.003 A, or 3 mA. STRATEGY The plot shows that current is proportional to voltage, which is Ohm’s law. In Ohm’s law ( ), the constant of proportionality is the resistance R. Because the graph shows current as a function of voltage, we have to rearrange Ohm’s law in that form: . This shows that the slope of the line of I versus V is . Thus, if we f",300,318,
398,627,0,images/page0627_img000.png,"Figure 19.8 The photo on the left shows a chip that contains complex integrated electric circuitry. Chips such as this are at the heart of devices such as computers and cell phones. The photograph on the right shows some typical electric circuitry required for high-power electric power transmission. The pathways that form electric circuits are made from a conducting material, normally a metal in macroscopic circuits. For example, copper wires inside your school building form the electrical circu",732,294,
399,627,1,images/page0627_img001.png,"Figure 19.9 On the left is a circuit diagram showing a battery (in red), a resistor (black zigzag element), and the current I. On the right is the analogous water circuit. The pump is like the battery, the sand filter is like the resistor, the water current is like the electrical current, and the reservoir is like the ground. There are many different symbols that scientists and engineers use in circuit diagrams, but we will focus on four main symbols: the wire, the battery or voltage source, res",732,371,
400,628,0,images/page0628_img000.png,"Figure 19.10 Some typical resistors. The color bands indicate the value of the resistance of each resistor. The electric current in Figure 19.9 is indicted by the blue line labeled I. The arrow indicates the direction in which positive charge would flow in this circuit. Recall that, in metals, electrons are mobile charge carriers, so negative charges actually flow in the opposite direction around this circuit (i.e., counterclockwise). However, we draw the current to show the direction in which p",300,200,
401,629,0,images/page0629_img000.png,"Figure 19.11 The voltage in the red wire is constant at from the positive terminal of the battery to the top of the resistor. The voltage in the blue wire is constant at from the bottom of the resistor to the negative terminal of the battery. If we go from the blue wire through the battery to the red wire, the voltage increases from to . Likewise, if we go from the blue wire up through the resistor to the red wire, the voltage also goes from to . Thus, using Ohm’s law, we can write",237,275,
402,630,0,images/page0630_img000.png,"Figure 19.12 On the left is an electrical circuit containing a battery, a switch, and a capacitor. On the left is the analogous water circuit with a pump, a valve, and a stretchable membrane. The pump is like the battery, the valve is like the switch, and the stretchable membrane is like the capacitor. When the switch is closed, electrical current flows as the capacitor charges and its voltage increases. Likewise in the water circuit, when the valve is open, water current flows as the stretchabl",721,442,
403,631,0,images/page0631_img000.png,Figure 19.13 The systems that electrical engineers work on range from microprocessor circuits (left)] to missile systems (right). Virtual Physics Click to view content (http://www.openstax.org/l/21phetcirconstr) Amuse yourself by building circuits of all different shapes and sizes. This simulation provides you with various standard circuit elements such as batteries AC voltage sources resistors capacitors light bulbs switches etc You can connect,488,230,
404,632,0,images/page0632_img000.png,"Figure 19.14 On the left is an electric circuit with three resistors R1, R2, and R3 connected in series. On the right is an electric circuit with one resistor Requiv that is equivalent to the combination of the three resistors R1, R2, and R3. We will now try to find a single resistance that is equivalent to the three resistors in series on the left side of Figure 19.14. An equivalent resistor is a resistor that has the same resistance as the combined resistance of a set of other resistors. In ot",486,223,
405,634,0,images/page0634_img000.png,"The four resistances in this circuit are connected in series, so we know that they must add up to give the equivalent resistance.",300,246,
406,635,3,images/page0635_img003.png,19.3 Parallel Circuits Section Learning Objectives,281,61,
407,635,4,images/page0635_img004.png,19.3 Parallel Circuits Section Learning Objectives,283,71,
