Diagram-ID,Page-Number,Image-Index,Image-Path,Modified-Alt-Text
331,521,1,ai/data/page0521_img001.png,"This is a two part diagram of the comparison of common vision defects in the human eye. In part (a), myopia, or nearsightedness, is shown. Parallel rays from a distant object enter the eye and are converged too strongly, causing them to come to a focus in front of the retina. By the time the rays reach the retina, they are diverging, which results in a blurred image. This effect can occur if the eye’s lens is too strong, meaning it has a focal length that is too short, or if the eye itself is too long from front to back. In part (b), hyperopia, or farsightedness, is illustrated. Rays from a nearby object enter the eye but are not converged enough by the cornea and lens before reaching the retina. As a result, the rays would focus at a point behind the retina, producing blurred vision for close objects. This condition can occur if the lens is too weak, meaning its focal length is too long, or if the eye is too short."
332,522,0,ai/data/page0522_img000.png,"This is a two-part diagram. In part (a), correction of nearsightedness is illustrated. Parallel rays from a distant object first pass through a diverging corrective lens placed in front of the eye. This lens spreads the rays slightly before they enter the eye, compensating for the eye’s overconvergence. As a result, the rays are focused precisely on the retina, allowing the distant object to be seen clearly. The diverging lens forms a virtual image closer to the eye than the original object.In part (b), correction of farsightedness is shown. Rays from a close object pass through a converging corrective lens before entering the eye. The converging lens bends the rays inward, compensating for the eye’s underconvergence. This causes the rays to focus on the retina rather than behind it, producing a clear image of nearby objects. In this case, the converging lens forms a virtual image farther from the eye than the actual object."
333,523,0,ai/data/page0523_img000.png,"image formation by a converging lens. A light bulb is placed at an object distance (do) of 0.75 meters (m) from a lens with focal length (f) of 0.50 meters (m). The focal point (F) is marked on the object side of the lens. Light rays from the bulb pass through the lens and converge on the opposite side, forming a real image on a screen located at an image distance (di) of 1.50 m. One ray travels parallel to the optical axis and refracts through the focal point after passing through the lens, while another ray passes through the center of the lens without bending. The intersection of these rays determines the position and size of the real image on the screen, demonstrating how ray tracing predicts image location and magnification."
334,530,0,ai/data/page0530_img000.png,"refraction of a light ray as it passes through multiple layers of materials with different refractive indices. A ray enters the first medium with refractive index (n1) at an incident angle (theta1), measured from the normal to the surface. Upon crossing into the second medium with refractive index (n2), the ray bends and travels at a refracted angle (theta2), demonstrating how a change in refractive index alters the ray’s direction according to Snell’s law.The ray then enters a third medium with refractive index (n3), where it refracts again and travels at an angle (theta3). Dashed lines show the continuation of the ray if no refraction had occurred, highlighting the bending at each boundary. The horizontal displacement between the actual ray path and the dashed reference path is labeled (delta x), indicating the lateral shift caused by refraction through layered media. The diagram emphasizes how changes in refractive index affect both ray direction and lateral position."
336,534,1,ai/data/page0534_img001.png,"refraction and apparent depth for an object viewed across an air–water boundary. A light source is located underwater at a depth (d) of 2.0 meters (m) below the water surface. Light rays emitted from the source travel upward through the water and refract at the water–air interface. After refraction, the rays bend away from the normal as they enter air and travel toward an observer standing at the edge of a platform 2.0 meters (m) horizontally from the refraction point. Dashed lines show the backward extensions of the refracted rays, indicating the apparent position of the underwater object as seen by the observer. Because of refraction, the object appears shallower than its actual depth. The diagram highlights how the change in refractive index between water and air alters ray paths and causes the apparent location of the light source to differ from its true position."
338,538,0,ai/data/page0538_img000.png,"This is a two part diagram of the comparison of ray-like and wave-like behavior of light. In part (a), a powerful laser at the Paranal Observatory emits a narrow beam that travels in a straight line through the night sky, appearing as a single well-defined ray directed upward toward the Milky Way. This image illustrates how light can be modeled as rays when describing straight-line propagation over long distances. In part (b), a laser beam passes through a grid of closely spaced vertical slits and produces a pattern of bright and dark spots on a screen. This interference pattern results from overlapping light waves that constructively and destructively interfere, demonstrating the wave nature of light. Together, the two ai/data show that light exhibits both ray-like behavior in propagation and wave-like behavior through interference."
340,539,0,ai/data/page0539_img000.png,"Huygens’ principle applied to a straight wavefront. An initial straight wavefront, labeled as the old wavefront, is shown as a vertical line. Each point along this wavefront acts as a source of a semicircular wavelet that propagates forward with speed (v). After a time interval (t), each wavelet has advanced a distance (s), where (s = v t). The new wavefront is constructed by drawing a line tangent to the advancing wavelets, forming another straight line parallel to the original wavefront. An arrow indicates the direction of wave propagation, perpendicular to the wavefronts. The diagram demonstrates how uniform forward motion of a wave can be understood as the combined effect of many secondary wavelets, providing the basis for explaining reflection, refraction, and diffraction of waves."
341,540,0,ai/data/page0540_img000.png,"diffraction using Huygens’ principle. A straight wavefront approaches an opening in a barrier and passes through the gap. After passing through the opening, the wavefront no longer remains straight. Instead, the edges of the wavefront bend outward and spread into the region beyond the opening. This bending of waves around the edges of an opening is called diffraction. This shows that when the opening is relatively wide, the wavefront spreads only slightly and continues mostly in its original direction. When the opening is narrow, comparable in size to the wavelength, the wave spreads out more strongly and forms curved wavefronts. Arrows indicate the direction of wave propagation before and after the opening. The figure demonstrates that diffraction effects become more pronounced when the size of the opening is similar to the wavelength of the wave, a behavior commonly observed in water waves, sound waves, and light."
343,541,0,ai/data/page0541_img000.png,"Young’s double-slit experiment. Light of a single wavelength travels toward a barrier containing two narrow, closely spaced vertical slits. After passing through the slits, the light spreads out due to diffraction and the emerging waves overlap. On the screen beyond the slits, this overlap produces a diffraction and interference pattern consisting of many bright and dark vertical fringes that are spread out horizontally. This contrasts this result with the case in which diffraction and interference do not occur. Without these wave effects, the light would form only two bright vertical lines corresponding to the positions of the slits. Instead, each slit acts as a source of semicircular wavefronts, and constructive interference occurs at points where the waves arrive in phase, while destructive interference produces dark regions. This figure demonstrates the wave nature of light through diffraction and interference."
344,541,1,ai/data/page0541_img001.png,"This is a three part diagram of the interference from a double-slit arrangement using wavefronts, water waves, and light. In part (a), plane wavefronts approach a barrier containing two narrow slits labeled (S1) and (S2). Each slit acts as a source of circular wavefronts due to diffraction. As these wavefronts spread outward, they overlap and interfere. On the screen to the right, regions of constructive interference produce intensity maxima, labeled “Max,” while regions of destructive interference produce minima, labeled “Min.”. In part (b), a pattern formed by water waves passing through two openings is shown. The overlapping circular ripples create a series of alternating regions of strong and weak wave motion, demonstrating constructive and destructive interference similar to that of light. In part (c), a photograph of the light interference pattern produced by a double-slit experiment is shown as a series of bright and dark vertical fringes on a screen. Together, the three panels demonstrate that double slits produce two coherent wave sources whose interference patterns are the same for light and water waves, confirming the wave nature of light."
345,542,0,ai/data/page0542_img000.png,"The geometry of path difference in a double-slit interference experiment. Two narrow slits, labeled (S1) and (S2), are separated by a vertical distance (d). Light from each slit travels to a common point on a distant screen at an angle (theta) measured from the central axis. The two ray paths have lengths (L1) and (L2), which differ by a path difference (delta L). From the geometry of the diagram, the path difference is given by (delta L = d sin theta), assuming that the distance to the screen is much greater than the separation between the slits. This path difference determines whether the light arriving at the screen produces constructive or destructive interference. The figure provides the basis for predicting the positions of bright and dark interference fringes on the screen as a function of angle."
346,543,0,ai/data/page0543_img000.png,"the intensity of a double-slit interference pattern varies with angle and position on a screen. Light passes through two narrow slits separated by a distance (d) and travels to a screen located a horizontal distance (x) away. Rays from the slits reach points on the screen at angles (theta1) and (theta2) relative to the central axis. The vertical positions on the screen are labeled (y1) and (y2), corresponding to different angles and path differences. The intensity distribution on the screen is shown as a curve with a central maximum and a series of smaller maxima and minima on either side. The amplitude of the maxima decreases as the angle from the center increases, indicating that the bright fringes become dimmer farther from the central axis. A photograph of the actual interference pattern appears alongside the diagram, showing multiple bright and dark vertical fringes. The figure emphasizes that the double-slit pattern is modulated by diffraction, causing the overall intensity to fall off with increasing angle."
347,543,1,ai/data/page0543_img001.png,"This is a three part diagram of single-slit diffraction and the resulting intensity pattern. In part (a), monochromatic light passes through a single narrow slit of width (D). After the slit, the light spreads out due to diffraction and forms a pattern on a distant screen. The pattern consists of a bright central maximum and a series of smaller, dimmer maxima on either side. The central maximum is much more intense than the others and is noted to be several times higher than depicted in the drawing. In part (b), a schematic representation of the diffraction pattern on the screen is shown, with a wide, bright central band and thinner, less intense bright bands separated by dark regions. This illustrates how intensity decreases away from the center. In part (c), the intensity of the diffraction pattern is plotted as a function of (sin theta). The central maximum occurs at (sin theta = 0). Minima appear at values given by (sin theta = plus or minus lambda over D), (plus or minus 2 lambda over D), and (plus or minus 3 lambda over D), where (lambda) is the wavelength of the light. The figure shows how the positions of dark fringes depend on the wavelength and the slit width, demonstrating the angular distribution of intensity for single-slit diffraction."
348,544,0,ai/data/page0544_img000.png,"the geometry and equations for single-slit diffraction minima. Light passes through a single slit of width (D) and travels to a screen a distance (L) away. Rays from the top and bottom edges of the slit travel to a point on the screen at an angle (theta) relative to the central axis. At certain angles, these rays interfere destructively, producing dark regions, or minima, in the diffraction pattern. The vertical distance from the center of the diffraction pattern to a minimum on the screen is labeled (y). The condition for destructive interference is given by the distance between the slits, multiplied by the sine of the observation angle, is equal to a whole-number multiple of the wavelength of the light (D sin theta = m lambda), where (lambda) is the wavelength of the light and (m) is a nonzero integer indicating the order of the minimum. For small angles, this condition can also be written as (D y / L = m lambda), the slit separation multiplied by the vertical distance to the bright or dark fringe, divided by the distance to the screen, equals an integer multiple of the wavelength. The diagram visually connects the geometric path difference to the mathematical expressions used to calculate the positions of dark fringes in a single-slit diffraction pattern."
349,547,0,ai/data/page0547_img000.png,"diffraction by a diffraction grating. A diffraction grating consists of many evenly spaced, parallel slits that act together to diffract light. In part (a), light passing through the grating spreads out and forms bright regions at specific angles due to constructive interference, similar to but sharper than the pattern produced by a double slit. Most directions experience destructive interference, while only certain angles produce intense maxima. In part (b), white light is incident on the diffraction grating. The central maximum appears white because all wavelengths overlap at zero angle. At larger angles, the first-order and second-order maxima separate the different wavelengths, producing rainbow-colored spectra on either side of the central maximum. Higher-order rainbows appear farther from the center, showing how a diffraction grating disperses white light into its component colors with increasing angular separation."
350,548,0,ai/data/page0548_img000.png,"This is a two part diagram of examples of natural diffraction and reflection gratings. In part (a), an Australian opal displays bright, shifting colors caused by microscopic layers inside the gemstone. These layers act like a reflection grating, reflecting different wavelengths of light at different angles, which produces the characteristic multicolored appearance. In part (b), a butterfly wing is shown with vivid blue coloration. The color does not come primarily from pigments, but from rows of microscopic reflective structures on the wing surface. These structures act like a reflection grating, causing constructive interference for certain wavelengths while canceling others. As a result, different colors are reflected depending on the viewing angle. Together, the ai/data demonstrate how diffraction and interference can produce color in both minerals and biological"
351,548,1,ai/data/page0548_img001.png,"Comparison of idealized intensity patterns for monochromatic light passing through a double slit and a diffraction grating. In part (a), the double-slit pattern is shown as a series of broad intensity maxima and minima. The central maximum corresponds to order (m = 0), with first-order maxima at (m = plus or minus 1) on either side. The peaks are relatively wide, and the intensity between them does not drop completely to zero. In part (b), the diffraction grating pattern is shown. The maxima occur at the same angular positions as in the double-slit case for the same orders (m = 0, plus or minus 1), but the peaks are much narrower and taller. The regions between maxima are darker, indicating more complete destructive interference. The figure demonstrates that increasing the number of slits produces sharper, more well-defined maxima, which is why diffraction gratings provide better angular resolution than double slits."
354,550,1,ai/data/page0550_img001.png,"diffraction grating functions inside a spectroscope. Light from a source enters the instrument and travels toward a diffraction grating. As the light strikes the grating, it is diffracted and separated into different wavelengths, which propagate at different angles due to constructive and destructive interference. Mirrors redirect the diffracted light toward a detector. Each wavelength follows a distinct path, producing a spread of colors at the detector that forms a spectrum. The diagram illustrates how diffraction enables the analysis of light by wavelength, allowing a spectroscope to identify the composition of a light source. At the same time, it highlights that diffraction is an inherent wave effect that can also limit image sharpness by spreading light rather than keeping it perfectly focused."
355,551,0,ai/data/page0551_img000.png,"This is a three part diagram of the diffraction limits image resolution. In part (a), monochromatic light passing through a small circular aperture produces a diffraction pattern with a bright central region and a blurred edge rather than a sharp point. This pattern shows how light spreads when constrained by a finite aperture. In part (b), two point light sources that are close together produce overlapping diffraction patterns. Although two bright regions can still be distinguished, their ai/data partially overlap due to diffraction. In part (c), the two point sources are even closer together, and their diffraction patterns overlap so strongly that they merge into a single blurred image. In this case, the sources cannot be resolved as separate objects. The figure demonstrates that diffraction sets a fundamental limit on the amount of detail that can be observed when light passes through an aperture, regardless of the quality of the optical system."
356,552,0,ai/data/page0552_img000.png,"This is a two part diagram of diffraction from a circular aperture and the Rayleigh criterion for resolution. In part (a), the intensity of the diffraction pattern produced by a circular aperture is plotted as a function of angle (theta). The pattern shows a bright, wide central maximum centered at (theta = 0), with much smaller and dimmer secondary maxima on either side. The first minima on either side of the central maximum occur at angles given by (plus or minus 1.22 lambda over D), where (lambda) is the wavelength of light and (D) is the diameter of the aperture. In part (b), two point objects produce overlapping diffraction patterns on an imaging system. The Rayleigh criterion is illustrated for the case where the two objects are just resolvable. This occurs when the central maximum of one diffraction pattern lies at the first minimum of the other, corresponding to a minimum angular separation labeled (theta min). The diagram shows how diffraction limits the ability of an optical system to distinguish closely spaced objects."
358,564,0,ai/data/page0564_img000.png,"the basic behavior of electric charge using glass rods and silk cloth. When a glass rod is rubbed with silk, electric charge is transferred so that the glass rod becomes positively charged and the silk becomes negatively charged. In part (a), the positively charged glass rod is shown attracting the negatively charged silk cloth, demonstrating that opposite charges attract each other. In part (b), two glass rods that have both been rubbed with silk carry the same type of charge and repel one another, showing that like charges repel. In part (c), two silk cloths that have acquired the same negative charge also repel each other. The figure highlights the existence of two types of electric charge and shows that attraction and repulsion depend on whether the charges are opposite or the same."
359,565,0,ai/data/page0565_img000.png,"Comparison of two historical models of the atom. On the left is Thomson’s plum-pudding model, in which negatively charged electrons are embedded within a diffuse, uniform sphere of positive charge. In this model, the positive charge fills the entire atom, and the electrons are distributed throughout it like plums in a pudding. On the right is Rutherford’s nuclear model of the atom. In this model, a small, dense, positively charged nucleus is located at the center of the atom, while electrons move around the nucleus in extended orbits. The diagram emphasizes that the nucleus is extremely small compared with the size of the electron orbits; its size is greatly exaggerated for visibility. Together, the two drawings illustrate the major shift in understanding atomic structure from a diffuse positive charge to a concentrated central nucleus."
360,566,0,ai/data/page0566_img000.png,"the setup of the oil-drop experiment used to measure the elementary electric charge. A fine mist of oil droplets is sprayed from an atomizer into the space between two horizontal metal plates. A bright light illuminates the region so individual oil droplets can be observed through a viewing telescope. The upper and lower plates are connected to a voltage source, creating a uniform electric field (E) between them. An oil droplet experiences a downward gravitational force (w) due to its weight and an upward electric force (Fe) when the electric field is applied. By adjusting the voltage across the plates, the electric force can be made to balance the weight of a droplet, allowing it to remain suspended. By knowing the mass of the oil droplet and the electric field strength required to balance it, the electric charge on the droplet can be calculated. Repeated measurements showed that the charges on the droplets always occurred in discrete multiples of a fundamental value, demonstrating that electric charge is quantized."
361,567,0,ai/data/page0567_img000.png,"This is a three part diagram of a step-by-step procedure using adhesive tape to demonstrate electric charging. In part (a), two strips of tape are placed together on a nonmetallic surface, with one strip stuck directly on top of the other. Each strip has a folded end that serves as a handle. In part (b), the two attached pieces of tape are peeled off the surface together, and a finger is gently stroked along the nonsticky side of the top piece. This action helps redistribute electric charge on the tape. In part (c), the two pieces of tape are pulled apart by their handles. As they separate, the tapes acquire electric charges and can be observed to interact electrically, such as by attracting or repelling other charged objects. The figure illustrates how contact and separation can produce electric charging through everyday materials."
362,567,1,ai/data/page0567_img001.png,"This is a three part diagram of observations from a tape-charging experiment used to test basic principles of electric charge. In part (a), a strip of tape that has been electrically charged is shown interacting with another charged tape. The tapes move apart, indicating repulsion between them. This occurs because both tapes carry the same type of electric charge. In part (b), a tape is shown being handled and repositioned after charge redistribution. The interaction between tapes changes as charge is transferred or rearranged during the process. In part (c), two pieces of tape are brought close together and are observed to move toward each other, indicating attraction. This occurs because the two tapes now carry opposite types of electric charge. The figure reinforces the principle that like charges repel each other, while unlike charges attract each other."
363,568,0,ai/data/page0568_img000.png,"The conservation of electric charge during an interaction between two objects. Before the interaction, a blue sphere carries a charge of plus 4 Coulombs (C) and a red sphere carries a charge of plus 8 Coulombs (C). After the interaction, the blue sphere is shown with a charge of plus 10 Coulombs (C), while the final charge on the red sphere is unknown and labeled (q red). The diagram emphasizes that electric charge is conserved during interactions. The total charge before the interaction equals the total charge after the interaction, allowing the final charge on the red sphere to be determined by accounting for the change in charge on the blue sphere."
