Diagram-ID,Page-Number,Image-Index,Image-Path,Caption,Width,Height,Modified-Alt-Text
32,49,0,images/page0049_img000.png,"Figure 1.26 The graph of the train’s distance from the station versus time from the exercise above. 5. Add a title to the top of the graph to state what the graph is describing, such as the y-axis parameter vs. the x-axis parameter. In the graph shown here, the title is train motion. It could also be titled distance of the train from the station vs. time. 6. Finally, with data points now on the graph, you should draw a trend line (Figure 1.27). The trend line represents the dependence you think ",733,490,
33,50,0,images/page0050_img000.png,"Figure 1.27 The completed graph with the trend line included. Analyzing a Graph Using Its Equation One way to get a quick snapshot of a dataset is to look at the equation of its trend line. If the graph produces a straight line, the equation of the trend line takes the form The b in the equation is the y-intercept while the m in the equation is the slope. The y-intercept tells you at what y value the lineh",733,490,
34,51,0,images/page0051_img000.png,"Figure 1.28 Examples of (a) linear, (b) quadratic, (c) inverse, and (d) exponential relationship graphs. Using Logarithmic Scales in Graphing Sometimes a variable can have a very large range of values. This presents a problem when you’re trying to figure out the best scale to use for your graph’s axes. One option is to use a logarithmic (log) scale. In a logarithmic scale, the value each mark labels",975,859,
35,52,0,images/page0052_img000.png,Figure 1.29 (a) The Richter scale uses a log base 10 scale on its y-axis (microns of amplified maximum ground motion). (b) The relationship between the frequency and wavelength of electromagnetic radiation can be plotted as a straight line if a log-log plot is used. Virtual Physics Graphing Lines In this simulation you will examine how changing the slope and y-intercept of an equation changes the appearance of a plotted line Select slope-intercept form and drag the blue circles along the line to,894,490,
36,64,0,images/page0064_img000.png,a y-intercept of on a graph.,450,435,
43,73,0,images/page0073_img000.png,,731,244,
45,77,0,images/page0077_img000.png,"Figure 2.8 During a 30-minute round trip to the store, the total distance traveled is 6 km. The average speed is 12 km/h. The displacement for the round trip is zero, because there was no net change in position. WORKED EXAMPLE Calculating Average Speed A marble rolls 5.2 m in 1.8 s. What was the marble's average speed?",731,349,
46,78,0,images/page0078_img000.png,"Figure 2.9 The diagram shows a more detailed record of an airplane passenger heading toward the back of the plane, showing smaller segments of his trip. Earlier, you have read that distance traveled can be different than the magnitude of displacement. In the same way, speed can be different than the magnitude of velocity. For example, you drive to a store and return home in half an hour. If your car’s odometer shows the total distance traveled was 6 km, then your average speed was 12 km/h. Your ",731,446,
47,82,0,images/page0082_img000.png,"Figure 2.10 The diagram shows a straight-line graph. The equation for the straight line is y equals mx + b. In physics, time is usually the independent variable. Other quantities, such as displacement, are said to depend upon it. A graph of position versus time, therefore, would have position on the vertical axis (dependent variable) and time on the horizontal axis (independent variable). In this case, to what would the slope and y-intercept refer? Let’s look back at our original example when st",487,298,
48,82,1,images/page0082_img001.png,"Figure 2.11 A graph of position versus time for the drive to school is shown. What would the graph look like if we added the return trip? As we said before, d0 = 0 because we call home our O and start calculating from there. In Figure 2.11, the line starts at d = 0, as well. This is the b in our equation for a straight line. Our initial position in a position versus time graph is always the place where the graph crosses the x-axis at t = 0. What is the slope? The rise is the change in position, ",487,344,
49,83,0,images/page0083_img000.png,"Figure 2.12 The diagram shows a graph of position versus time for a jet-powered car on the Bonneville Salt Flats. Using the relationship between dependent and independent variables, we see that the slope in the graph in Figure 2.12 is average velocity, vavg and the intercept is displacement at time zero—that is, d0. Substituting these symbols into y = mx + b gives or 2.5 2.6",487,394,
50,85,0,images/page0085_img000.png,Figure 2.13 The diagram shows the position of a jet-powered car during the time span when it is speeding up. The slope of a distance versus time graph is velocity. This is shown at two points. Instantaneous velocity at any point is the slope of the tangent at that point.,487,377,
52,86,0,images/page0086_img000.png,16. True or False: By taking the slope of the curve in the graph you can verify that the velocity of the jet car is,450,297,
53,86,1,images/page0086_img001.png,Check Your Understanding 17. Which of the following information about motion can be determined by looking at a position vs. time graph that is a,450,375,
54,88,0,images/page0088_img000.png,"Figure 2.15 A graph of position versus time for the drive to and from school is shown. We assumed for our original calculation that your parent drove with a constant velocity to and from school. We now know that the car could not have gone from rest to a constant velocity without speeding up. So the actual graph would be curved on either end, but let’s make the same approximation as we did then, anyway. TIPS FOR SUCCESS It is common in physics, especially at the early learning stages, for certai",731,346,
55,88,1,images/page0088_img001.png,"Figure 2.16 Graph of velocity versus time for the drive to and from school. We can learn a few things. First, we can derive a v versus t graph from a d versus t graph. Second, if we have a straight-line position–time graph that is positively or negatively sloped, it will yield a horizontal velocity graph. There are a few other interesting things to note. Just as we could use a position vs. time graph to determine velocity, we can use a velocity vs. time graph to determine position. We know that ",487,377,
56,89,0,images/page0089_img000.png,"Figure 2.17 A graph is shown of the position of a jet-powered car during the time span when it is speeding up. The slope of a d vs. t graph is velocity. This is shown at two points. Instantaneous velocity at any point is the slope of the tangent at that point. You do not have to do this, but you could, theoretically, take the instantaneous velocity at each point on this graph. If you did, you would get Figure 2.18, which is just a straight line with a positive slope.",487,377,
57,90,0,images/page0090_img000.png,"Figure 2.18 The graph shows the velocity of a jet-powered car during the time span when it is speeding up. Again, if we take the slope of the velocity vs. time graph, we get the acceleration, the rate of change of the velocity. And, if we take the area under the slope, we get back to the displacement. Solving Problems using Velocity–Time Graphs Most velocity vs. time graphs will be straight lines. When this is the case, our calculations are fairly simple.",487,427,
58,91,0,images/page0091_img000.png,"Figure 2.19 The graph shows a more accurate graph of the velocity of a jet-powered car during the time span when it is speeding up. WORKED EXAMPLE Using Curvy Velocity Graph to Calculate Some Stuff: jet car, Take Two Use Figure 2.19 to (a) find the approximate displacement of the jet car over the time shown, (b) calculate the instantaneous acceleration at t = 30 s, (c) find the instantaneous velocity at 30 s, and (d) calculate the approximate average velocity over the i l h",487,426,
59,92,0,images/page0092_img000.png,"Figure 2.20 Consider the velocity vs. time graph shown below of a person in an elevator. Suppose the elevator is initially at rest. It then speeds up for 3 seconds, maintains that velocity for 15 seconds, then slows down for 5 seconds until it stops. Find the instantaneous velocity at t = 10 s and t = 23 s. a. Instantaneous velocity at t = 10 s and t = 23 s are 0 m/s and 0 m/s. b. Instantaneous velocity at t = 10 s and t = 23 s are 0 m/s and 3 m/s. c. Instantaneous velocity at t = 10 s and t = 2",450,398,
60,93,0,images/page0093_img000.png,Figure 2.21 Calculate the net displacement and the average velocity of the elevator over the time interval shown. a. Net displacement is 45 m and average velocity is 2.10 m/s. b. Net displacement is 45 m and average velocity is 2.28 m/s. c. Net displacement is 57 m and average velocity is 2.66 m/s. d. Net displacement is 57 m and average velocity is 2.48 m/s.,450,398,
61,96,0,images/page0096_img000.png,You are driving a car toward the east and your friend,450,344,
62,97,0,images/page0097_img000.png,2.4 Velocity vs. Time Graphs 8. A graph of velocity vs. time of a ship coming into a harbor is,272,165,
63,98,0,images/page0098_img000.png,"2.1 Relative Motion, Distance, and Displacement",450,350,
64,98,1,images/page0098_img001.png,"The instantaneous velocity is greatest at f, and it is",450,352,
65,99,0,images/page0099_img000.png,The total average velocity is 0 m/s. The total average velocity is 1.2 m/s.,450,344,
66,99,1,images/page0099_img001.png,The total average velocity is 3.0 m/s. 20. A train starts from rest and speeds up for 15 minutes,450,420,
68,101,0,images/page0101_img000.png,31. A car travels with an average velocity of 23 m/s for 82 s.,450,344,
69,103,0,images/page0103_img000.png,own goalie. It stops just as it reaches her. She sends it,450,375,
70,103,1,images/page0103_img001.png,"bee to speed up or slow down, except at the moment it",450,429,
71,104,0,images/page0104_img000.png,52. What is the object’s average velocity? Extended Response,450,429,
72,104,1,images/page0104_img001.png,"Which path has the maximum distance? The distance for Path A is 6 m, Path B is 4 m, Path C",302,224,
73,105,0,images/page0105_img000.png,uniform motion any motion that accelerates,450,351,
74,105,1,images/page0105_img001.png,the bus stop at the same time. The father’s average speed,450,320,
75,105,2,images/page0105_img002.png,uniform motion During which points is the object slowing down and,450,343,
76,106,0,images/page0106_img000.png,,450,343,
82,114,0,images/page0114_img000.png,"Figure 3.6 The slope of displacement versus time is velocity. The second kinematic equation, another expression for average velocity is simply the initial velocity plus the final velocity divided by two. Now we come to our main focus of this chapter; namely, the kinematic equations that describe motion with constant l i I h hi d ki i i l i i h hi d ki i i l 3.5",342,336,
83,114,1,images/page0114_img001.png,"Figure 3.7 The slope of velocity versus time is acceleration. The fourth kinematic equation shows how displacement is related to acceleration When starting at the origin, and, when starting from rest, , in which case the equation can be written as 3.7",342,336,
84,115,0,images/page0115_img000.png,"Figure 3.8 When acceleration is constant, the slope of 2d versus t2 gives the acceleration. The fifth kinematic equation relates velocity, acceleration, and displacement This equation is useful for when we do not know, or do not need to know, the time. When starting from rest, the fifth equation simplifies to 3.8",300,168,
85,115,1,images/page0115_img001.png,"Figure 3.9 Note that, in reality, knowns and unknowns will vary. Sometimes you will want to rearrange a kinematic equation so that the knowns are the values on the axes and the unknown is the slope. Sometimes the intercept will not be at the origin (0,0). This will happen when v0 or d0 is not zero. This will be the case when the object of interest is already in motion, or the motion begins at some point other than at the origin of the coordinate system. Virtual Physics",300,273,
88,120,0,images/page0120_img000.png,"Figure 3.12 Initial conditions for rock thrown straight up. List the knowns: time t = 1.00 s, 2.00 s, and 3.00 s; initial velocity v0 = 13 m/s; acceleration a = g = –9.80 m/s2; and position y0 = 0 m List the unknowns: y1, y2, and y3; v1, v2, and v3—where 1, 2, 3 refer to times 1.00 s, 2.00 s, and 3.00 s Choose the equations.",488,152,
89,121,0,images/page0121_img000.png,"Figure 3.13 Discussion • y vs. t does not represent the two-dimensional parabolic path of a trajectory. The path of the rock is straight up and straight down. The slope of a line tangent to the curve at any point on the curve equals the velocity at that point—i.e., the instantaneous velocity.",488,1225,
90,126,0,images/page0126_img000.png,"They are perpendicular, forming a 270° angle between each other.",450,320,
93,131,0,images/page0131_img000.png,"Figure 4.2 An object of mass, m, is held up by the force of tension. Figure 4.2 shows the force of tension in the rope acting in the upward direction, opposite the force of gravity. The forces are indicated in the free-body diagram by an arrow pointing up, representing tension, and another arrow pointing down, representing gravity. In a free-body diagram, the lengths of the arrows show the relative magnitude (or strength) of the forces. Because forces are vectors, they add just like other vector",488,678,
94,133,0,images/page0133_img000.png,"Figure 4.3 For a box sliding across a floor, friction acts in the direction opposite to the velocity. The force of friction depends on two factors: the coefficient of friction and the normal force. For any two surfaces that are in contact with one another, the coefficient of friction is a constant that depends on the nature of the surfaces. The normal force is the force exerted by a surface that pushes on an object in response to gravity pulling the object down. In equation form, the force of fr",731,622,
97,139,0,images/page0139_img000.png,"Figure 4.6 Strategy Because Fnet and m are given, the acceleration can be calculated directly from Newton’s second law: Fnet = ma. Solution Solving Newton’s second law for the acceleration, we find that the magnitude of the acceleration, a, is Entering the given values for net external force and mass gives",487,301,
100,144,0,images/page0144_img000.png,"Figure 4.9 When a perfectly flexible connector (one requiring no force to bend it) such as a rope transmits a force T, this force must be parallel to the length of the rope, as shown. The pull that such a flexible connector exerts is a tension. Note that the rope pulls with equal magnitude force but in opposite directions to the hand and to the mass (neglecting the weight of the rope). This is an example of Newton’s third law. The rope is the medium that transmits forces of equal magnitude betwe",187,509,
105,158,0,images/page0158_img000.png,"Figure 5.2 A person walks nine blocks east and five blocks north. The displacement is 10.3 blocks at an angle north of east. The head-to-tail method is a graphical way to add vectors. The tail of the vector is the starting point of the vector, and the head (or tip) of a vector is the pointed end of the arrow. The following steps describe how to use the head-to-tail method for graphical vector addition. Access for free at openstax.org.",701,322,
108,160,0,images/page0160_img000.png,"Figure 5.5 The diagram shows the resultant vector, a ruler, and protractor. 5. To find the magnitude of the resultant, measure its length with a ruler. When we deal with vectors analytically in the next section, the magnitude will be calculated by using the Pythagorean theorem. 6. To find the direction of the resultant, use a protractor to measure the angle it makes with the reference direction (in this case, the x-axis). When we deal with vectors analytically in the next section, the direction ",355,437,
113,163,0,images/page0163_img000.png,"Figure 5.10 The resultant vector is drawn . (4) Use a ruler to measure the magnitude of R, remembering to convert back to the units of meters using the scale. Use a protractor to measure the direction of R. While the direction of the vector can be specified in many ways, the easiest way is to measure the angle between the vector and the nearest horizontal or vertical axis. Since R is south of the eastward pointing axis (the x-axis), we flip the protractor upside down and measure the angle betwee",486,329,
115,164,0,images/page0164_img000.png,Figure 5.12 Vectors can be added in any order to get the same result. WORKED EXAMPLE Subtracting Vectors Graphically: A Woman Sailing a Boat A woman sailing a boat at night is following directions to a dock. The instructions read to first sail 27.5 m in a direction,460,361,
116,164,1,images/page0164_img001.png,"Figure 5.13 In the diagram, the first leg of the trip is represented by vector A and the second leg is represented by vector B. Strategy We can represent the first leg of the trip with a vector A, and the second leg of the trip that she was supposed to take with a vector B. Since the woman mistakenly travels in the opposite direction for the second leg of the journey, the vector for second leg of the trip she actually takes is −B. Therefore, she will end up at a location A + (−B), or A −B. Note ",645,185,
117,164,2,images/page0164_img002.png,Figure 5.14 Vector –B represents traveling in the opposite direction of vector B. We use graphical vector addition to find where the woman arrives A + (−B). Access for free at openstax.org.,320,259,
118,165,0,images/page0165_img000.png,Figure 5.15 The vectors are placed head to tail. In this case and Discussion 5.3 5.4,466,234,
119,166,0,images/page0166_img000.png,"Figure 5.16 A boat attempts to travel across a river. What is the total velocity and direction of the boat? Solution By using a ruler, we find that the length of the resultant vector is 7.2 cm, which means that the magnitude of the total velocity is By using a protractor to measure the angle, we find Discussion 5.5",662,476,
120,168,0,images/page0168_img000.png,"Figure 5.17 For a right triangle, the sine, cosine, and tangent of θ are defined in terms of the adjacent side, the opposite side, or the hypotenuse. In this figure, x is the adjacent side, y is the opposite side, and h is the hypotenuse. Since, by definition, , we can find the length x if we know h and by using . Similarly, we can find the length of y by using . These trigonometric relationships are useful for adding vectors. When a vector acts in more than one dimension, it is useful to break ",389,154,
121,168,1,images/page0168_img001.png,"Figure 5.18 The vector , with its tail at the origin of an x- y-coordinate system, is shown together with its x- and y-components, and These vectors form a right triangle. and are defined to be the components of along the x- and y-axes. The three vectors, , , and , form a right triangle. If the vector is known, then its magnitude (its length) and its angle (its direction) are known. To find and , its x-",267,394,
122,169,0,images/page0169_img000.png,"Figure 5.19 The magnitudes of the vector components and can be related to the resultant vector and the angle with trigonometric identities. Here we see that and Suppose, for example, that is the vector representing the total displacement of the person walking in a city, as illustrated in Figure 5.20.",318,394,
124,170,0,images/page0170_img000.png,"Figure 5.21 The magnitude and direction of the resultant vector can be determined once the horizontal components and have been determined. Sometimes, the vectors added are not perfectly perpendicular to one another. An example of this is the case below, where the vectors and are added to produce the resultant as illustrated in Figure 5.22.",255,358,
125,171,0,images/page0171_img000.png,"Figure 5.22 Vectors and are two legs of a walk, and is the resultant or total displacement. You can use analytical methods to determine the magnitude and direction of . If and represent two legs of a walk (two displacements), then is the total displacement. The person taking the walk ends up at the tip of . There are many ways to arrive at the same point. The person could have walked straight ahead first in the x-direction and then in the y-direction. Those paths are the x- and y-components of t",693,416,
126,171,1,images/page0171_img001.png,Figure 5.23 To add vectors and first determine the horizontal and vertical components of each vector. These are the dotted vectors shown in the image. 2. Find the x component of the resultant by adding the x component of the vectors and find the y component of the resultant (as illustrated in Figure 5.24) by adding the y component of the vectors.,693,416,
127,172,0,images/page0172_img000.png,"Figure 5.24 The vectors and add to give the magnitude of the resultant vector in the horizontal direction, Similarly, the vectors and add to give the magnitude of the resultant vector in the vertical direction, Now that we know the components of we can find its magnitude and direction. 3. To get the magnitude of the resultant R, use the Pythagorean theorem.",728,476,
128,173,0,images/page0173_img000.png,"Figure 5.25 You can use analytical models to add vectors. Strategy The components of and along the x- and y-axes represent walking due east and due north to get to the same ending point. We will solve for these components and then add them in the x-direction and y-direction to find the resultant. Solution First, we find the components of and along the x- and y-axes. From the problem, we know that d W fi d th t b i hi h i",659,364,
131,177,1,images/page0177_img001.png,"Figure 5.28 A boy kicks a ball at angle θ, and it is displaced a distance of s along its trajectory. As usual, we use velocity, acceleration, and displacement to describe motion. We must also find the components of these variables along the x- and y-axes. The components of acceleration are then very simple ay = –g = –9.80 m/s2. Note that this definition defines the upwards direction as positive. Because gravity is vertical, ax = 0. Both accelerations are constant, so we can use the kinematic equ",480,302,
133,180,0,images/page0180_img000.png,"Figure 5.30 The diagram shows the trajectory of a fireworks shell. Strategy The motion can be broken into horizontal and vertical motions in which and . We can then define and to be zero and solve for the maximum height. Solution for (a) By height we mean the altitude or vertical position above the starting point. The highest point in any trajectory, the maximum h i h i h d h hi i h h h i l l i i h f i i ( d ) i",288,384,
137,187,0,images/page0187_img000.png,"Figure 5.34 The diagram shows perpendicular and horizontal components of weight on an inclined plane. When an object rests on an incline that makes an angle with the horizontal, the force of gravity acting on the object is divided into two components: A force acting perpendicular to the plane, , and a force acting parallel to the plane, . The perpendicular force of weight, , is typically equal in magnitude and opposite in direction to the normal force, The force acting parallel to the plane, , c",698,300,
139,190,0,images/page0190_img000.png,"Figure 5.36 Now use the diagram to help find the skier's acceleration if friction is negligible and if the frictional force is 45.0 N. Strategy The most convenient coordinate system for motion on an incline is one that has one coordinate parallel to the slope and one perpendicular to the slope. Remember that motions along perpendicular axes are independent. We use the symbol to mean perpendicular, and to mean parallel. The only external forces acting on the system are the skier’s weight, frictio",731,345,
141,193,1,images/page0193_img001.png,"Figure 5.38 (a) The plastic ruler has been released, and the restoring force is returning the ruler to its equilibrium position. (b) The net force is zero at the equilibrium position, but the ruler has momentum and continues to move to the right. (c) The restoring force is in the opposite direction. It stops the ruler and moves it back toward equilibrium again. (d) Now the ruler has momentum to the left. (e) In the absence of damping (caused by frictional forces), the ruler reaches its original ",729,183,
143,195,0,images/page0195_img000.png,"Figure 5.40 A simple pendulum has a small-diameter bob and a string that has a very small mass but is strong enough not to stretch. The linear displacement from equilibrium is s, the length of the arc. Also shown are the forces on the bob, which result in a net force of −mg sinθ toward the equilibrium position—that is, a restoring force. Everyday examples of pendulums include old-fashioned clocks, a child’s swing, or the sinker on a fishing line. For small displacements of less than 15 degrees, ",450,367,
166,252,0,images/page0252_img000.png,"Figure 7.8 Gravitational attraction is along a line joining the centers of mass (CM) of the two bodies. The magnitude of the force on each body is the same, consistent with Newton’s third law (action-reaction). For two bodies having masses m and M with a distance r between their centers of mass, the equation for Newton’s universal law of gravitation is",488,439,
167,254,0,images/page0254_img000.png,Figure 7.9 Cavendish used an apparatus like this to measure the gravitational attraction between two suspended spheres (m) and two spheres on a stand (M) by observing the amount of torsion (twisting) created in the fiber. The distance between the masses can be varied to check the dependence of the force on distance. Modern experiments of this type continue to explore gravity. Einstein’s Theory of General Relativity Einstein’s theory of general relativity explained some interesting properties of ,488,425,
